### ISSUE TITLE
[myStrom] Error 404 in calling /report

### ISSUE THREAD

**Issue by 6UzoTE** [openhab/openhab-addons#9133]
## Expected Behavior
Creating a thing for myStrom Smart Plug a call to the SmartPlug is performed and json data for temperature / power eg is retrieved

## Current Behavior
Querying the plug results in an 404
Error sending HTTP GET request to http://192.168.10.142/report. Got response code: 404
Calling a curl from OpenHAB host to the  192.168.10.142/report returns the desired json data
```

curl 192.168.10.142/report
{"power":0,"Ws":0,"relay":false,"temperature":21.93}

```

### OPENHAB tcpdump
```
21:55:00.799835 IP (tos 0x0, ttl 64, id 37315, offset 0, flags [DF], proto TCP (6), length 60)
    192.168.10.117.40384 > 192.168.10.142.http: Flags [S], cksum 0x9682 (incorrect -> 0x9857), seq 1680063631, win 64240, options [mss 1460,sackOK,TS val 2850796980 ecr 0,nop,wscale 7], length 0
21:55:00.921383 IP (tos 0x0, ttl 255, id 2594, offset 0, flags [none], proto TCP (6), length 44)
    192.168.10.142.http > 192.168.10.117.40384: Flags [S.], cksum 0xe77c (correct), seq 1721615, ack 1680063632, win 5744, options [mss 1436], length 0
21:55:00.921520 IP (tos 0x0, ttl 64, id 37316, offset 0, flags [DF], proto TCP (6), length 40)
    192.168.10.117.40384 > 192.168.10.142.http: Flags [.], cksum 0x966e (incorrect -> 0x1aa1), ack 1, win 64240, length 0
21:55:00.924985 IP (tos 0x0, ttl 64, id 37317, offset 0, flags [DF], proto TCP (6), length 149)
    192.168.10.117.40384 > 192.168.10.142.http: Flags [P.], cksum 0x96db (incorrect -> 0x0055), seq 1:110, ack 1, win 64240, length 109: HTTP, length: 109
	GET /report HTTP/1.1
	Accept-Encoding: gzip
	User-Agent: Jetty/9.4.20.v20190813
	Host: trockner.banes.lan
	
21:55:00.957441 IP (tos 0x0, ttl 255, id 2595, offset 0, flags [none], proto TCP (6), length 85)
    192.168.10.142.http > 192.168.10.117.40384: Flags [P.], cksum 0x985d (correct), seq 1:46, ack 110, win 5635, length 45: HTTP, length: 45
	HTTP/1.1 404 Not Found
	Connection: close
	
21:55:00.957556 IP (tos 0x0, ttl 64, id 37318, offset 0, flags [DF], proto TCP (6), length 40)
    192.168.10.117.40384 > 192.168.10.142.http: Flags [.], cksum 0x966e (incorrect -> 0x1a34), ack 46, win 64195, length 0
21:55:00.958728 IP (tos 0x0, ttl 255, id 2596, offset 0, flags [none], proto TCP (6), length 40)
    192.168.10.142.http > 192.168.10.117.40384: Flags [F.], cksum 0xfef3 (correct), seq 46, ack 110, win 5635, length 0
21:55:00.961774 IP (tos 0x0, ttl 64, id 37319, offset 0, flags [DF], proto TCP (6), length 40)
    192.168.10.117.40384 > 192.168.10.142.http: Flags [F.], cksum 0x966e (incorrect -> 0x1a33), seq 110, ack 47, win 64194, length 0
21:55:00.968251 IP (tos 0x0, ttl 255, id 2597, offset 0, flags [none], proto TCP (6), length 40)
    192.168.10.142.http > 192.168.10.117.40384: Flags [.], cksum 0xfef3 (correct), ack 111, win 5634, length 0
21:55:03.140002 IP (tos 0x0, ttl 255, id 2598, offset 0, flags [none], proto UDP (17), length 36)

```

### CURL tcpdump
```
21:57:11.281240 IP (tos 0x0, ttl 64, id 35176, offset 0, flags [DF], proto TCP (6), length 60)
    192.168.10.117.40400 > 192.168.10.142.http: Flags [S], cksum 0x9682 (incorrect -> 0x6f37), seq 279591781, win 64240, options [mss 1460,sackOK,TS val 2850927462 ecr 0,nop,wscale 7], length 0
21:57:11.397895 IP (tos 0x0, ttl 255, id 2661, offset 0, flags [none], proto TCP (6), length 44)
    192.168.10.142.http > 192.168.10.117.40400: Flags [S.], cksum 0xb9f7 (correct), seq 1787687, ack 279591782, win 5744, options [mss 1436], length 0
21:57:11.398051 IP (tos 0x0, ttl 64, id 35177, offset 0, flags [DF], proto TCP (6), length 40)
    192.168.10.117.40400 > 192.168.10.142.http: Flags [.], cksum 0x966e (incorrect -> 0xed1b), ack 1, win 64240, length 0
21:57:11.398627 IP (tos 0x0, ttl 64, id 35178, offset 0, flags [DF], proto TCP (6), length 128)
    192.168.10.117.40400 > 192.168.10.142.http: Flags [P.], cksum 0x96c6 (incorrect -> 0x5489), seq 1:89, ack 1, win 64240, length 88: HTTP, length: 88
	GET /report HTTP/1.1
	Host: trockner.banes.lan
	User-Agent: curl/7.64.0
	Accept: */*
	
21:57:11.424330 IP (tos 0x0, ttl 255, id 2662, offset 0, flags [none], proto TCP (6), length 183)
    192.168.10.142.http > 192.168.10.117.40400: Flags [P.], cksum 0xcc37 (correct), seq 1:144, ack 89, win 5656, length 143: HTTP, length: 143
	HTTP/1.1 200 OK
	Pragma: no-cache
	Cache-Control: no-store, no-cache
	Content-Type: application/json
	Content-Length: 52
	Connection: close
	
21:57:11.424393 IP (tos 0x0, ttl 64, id 35179, offset 0, flags [DF], proto TCP (6), length 40)
    192.168.10.117.40400 > 192.168.10.142.http: Flags [.], cksum 0x966e (incorrect -> 0xecc3), ack 144, win 64097, length 0
21:57:11.428653 IP (tos 0x0, ttl 255, id 2663, offset 0, flags [none], proto TCP (6), length 92)
    192.168.10.142.http > 192.168.10.117.40400: Flags [P.], cksum 0xa053 (correct), seq 144:196, ack 89, win 5656, length 52: HTTP
21:57:11.428692 IP (tos 0x0, ttl 64, id 35180, offset 0, flags [DF], proto TCP (6), length 40)
    192.168.10.117.40400 > 192.168.10.142.http: Flags [.], cksum 0x966e (incorrect -> 0xecc3), ack 196, win 64045, length 0
21:57:11.428886 IP (tos 0x0, ttl 64, id 35181, offset 0, flags [DF], proto TCP (6), length 40)
    192.168.10.117.40400 > 192.168.10.142.http: Flags [F.], cksum 0x966e (incorrect -> 0xecc2), seq 89, ack 196, win 64045, length 0
21:57:11.431217 IP (tos 0x0, ttl 255, id 2664, offset 0, flags [none], proto TCP (6), length 40)
    192.168.10.142.http > 192.168.10.117.40400: Flags [F.], cksum 0xd0d8 (correct), seq 196, ack 89, win 5656, length 0
21:57:11.431280 IP (tos 0x0, ttl 64, id 35182, offset 0, flags [DF], proto TCP (6), length 40)
    192.168.10.117.40400 > 192.168.10.142.http: Flags [.], cksum 0x966e (incorrect -> 0xecc2), ack 197, win 64044, length 0
21:57:11.432411 IP (tos 0x0, ttl 255, id 2665, offset 0, flags [none], proto TCP (6), length 40)
    192.168.10.142.http > 192.168.10.117.40400: Flags [.], cksum 0xd0d8 (correct), ack 90, win 5655, length 0

```
## Possible Solution
N/A

## Steps to Reproduce (for Bugs)
1. add addon MyStrom
2. create item pointing to Switch

## Context
Integration of Mystrom  Wifi Switch

## Your Environment

* Version used: openHAB 3.0.0.M3
* Environment name and version (e.g. Chrome 76, Java 8, Node.js 12.9, ...): Firefox 83
* Operating System and version (desktop or mobile, Windows 10, Raspbian Buster, ...): Raspbian GNU/Linux 10

**Comment by 6UzoTE** [comment]
hmm the amount of reaction was not overwhelming. Hover another update of the firmware solved it.
