### ISSUE TITLE
[shelly] http callback does not update linked item status

### ISSUE THREAD

**Issue by englishman-hu** [openhab/openhab-addons#7137]
## Expected Behavior
Updates received from device with http callback update linked item status.

## Current Behavior
Only the periodic polling updates the item status, the http callbacks received from the device are ignored.

## Steps to Reproduce (for Bugs)
Thing and item config:
```
Thing shelly:shelly1:test "shelly test" @ "test" [deviceIp="shelly2.home"]

Switch ShellyTestRelay "Shelly test relay" {channel="shelly:shelly1:test:relay#output"}
```

Relevant log, showing the received callbacks:
```
2020-03-09 18:18:12.070 [DEBUG] [elly.internal.api.ShellyEventServlet] - CallbackServlet: HTTP/1.1 Request from 192.168.42.61:37324/shelly/event/shelly1-8b18a1/relay/0?{type=[out_on]}
2020-03-09 18:18:12.072 [TRACE] [elly.internal.api.ShellyEventServlet] - Process event of type type=relay for device shelly1-8b18a1, index=0
2020-03-09 18:18:12.072 [TRACE] [shelly.internal.ShellyHandlerFactory] - Dispatch event to device handler shelly1-8b18a1
2020-03-09 18:18:32.074 [DEBUG] [elly.internal.api.ShellyEventServlet] - CallbackServlet: HTTP/1.1 Request from 192.168.42.61:37325/shelly/event/shelly1-8b18a1/relay/0?{type=[out_off]}
2020-03-09 18:18:32.075 [TRACE] [elly.internal.api.ShellyEventServlet] - Process event of type type=relay for device shelly1-8b18a1, index=0
2020-03-09 18:18:32.075 [TRACE] [shelly.internal.ShellyHandlerFactory] - Dispatch event to device handler shelly1-8b18a1
```

## Your Environment
OH 2.5.1 (also tested with 2.5.0, 2.5.2)
Linux&docker
shelly1, firmware 1.6.0 (also tested with 1.5.0)

**Comment by hmerk** [comment]
@englishman-hu 
Please change your thing config to IP-Address of your Shelly and retest.
AFAIK, the docs refer to IP only, not names.

**Comment by englishman-hu** [comment]
@hmerk  Well, the address resolution works fine, as device gets set up with the callback url's and the command and status polling works fine...

Nevertheless, I gave it a try, and the result is exactly the same:

Thing:
```
Thing shelly:shelly1:test "shelly test" @ "test" [deviceIp="192.168.42.61"]
```

Log:
```
2020-03-09 19:29:40.594 [DEBUG] [elly.internal.api.ShellyEventServlet] - CallbackServlet: HTTP/1.1 Request from 192.168.42.61:37326/shelly/event/shelly1-8b18a1/relay/0?{type=[out_on]}
2020-03-09 19:29:40.596 [TRACE] [elly.internal.api.ShellyEventServlet] - Process event of type type=relay for device shelly1-8b18a1, index=0
2020-03-09 19:29:40.597 [TRACE] [shelly.internal.ShellyHandlerFactory] - Dispatch event to device handler shelly1-8b18a1
2020-03-09 19:30:00.586 [DEBUG] [elly.internal.api.ShellyEventServlet] - CallbackServlet: HTTP/1.1 Request from 192.168.42.61:37327/shelly/event/shelly1-8b18a1/relay/0?{type=[out_off]}
2020-03-09 19:30:00.588 [TRACE] [elly.internal.api.ShellyEventServlet] - Process event of type type=relay for device shelly1-8b18a1, index=0
2020-03-09 19:30:00.589 [TRACE] [shelly.internal.ShellyHandlerFactory] - Dispatch event to device handler shelly1-8b18a1

```

**Comment by hmerk** [comment]
Ok, that‘s good so far.
Would you please check your logs for shelly handler initialisation.
Your thing id is named test, where it should be the last 6 letters of device mac.
Following this, it works absolutely fine in my installation.

**Comment by englishman-hu** [comment]
@hmerk 
According to the thing identification conceptof OH, the thing ID can be arbitrary string.
No no such limitation is mentioned in the binding doc. If it was, that would already be a bug...

However this is something I tried earlier (since I noticed the callback url containing the device ID, instead of the thing ID) with the same result.

Here are the details:

Thing:
```
Thing shelly:shelly1:8b18a1 "shelly test" @ "test" [deviceIp="192.168.42.61"]
```

Initialization log entries:
```
2020-03-09 20:04:31.782 [DEBUG] [shelly.internal.ShellyHandlerFactory] - Activate Shelly HandlerFactory
2020-03-09 20:04:31.789 [DEBUG] [shelly.internal.ShellyHandlerFactory] - Using OH HTTP port 8080
2020-03-09 20:04:31.982 [DEBUG] [shelly.internal.ShellyHandlerFactory] - Create new thing of type shelly1 using ShellyRelayHandler
2020-03-09 20:04:32.004 [DEBUG] [.internal.handler.ShellyRelayHandler] - Thing is using  class org.openhab.binding.shelly.internal.handler.ShellyRelayHandler
2020-03-09 20:04:32.021 [DEBUG] [elly.internal.api.ShellyEventServlet] - Shelly Binding: httpService bound
2020-03-09 20:04:32.022 [DEBUG] [elly.internal.api.ShellyEventServlet] - Shelly Binding: HandlerFactory bound
2020-03-09 20:04:32.063 [DEBUG] [elly.internal.api.ShellyEventServlet] - Shelly: CallbackServlet started at '/shelly/event'
2020-03-09 20:04:32.071 [TRACE] [discovery.ShellyDiscoveryParticipant] - Discovery: HandlerFactory bound
2020-03-09 20:04:32.078 [DEBUG] [discovery.ShellyDiscoveryParticipant] - Shelly Discovery service activated
...
...
2020-03-09 20:04:32.987 [DEBUG] [discovery.ShellyDiscoveryParticipant] - Shelly device shelly1-8b18a1 discovered with empty IP address
2020-03-09 20:04:32.988 [DEBUG] [discovery.ShellyDiscoveryParticipant] - Shelly device discovered: IP-Adress=192.168.42.61, name=shelly1-8b18a1
2020-03-09 20:04:32.988 [TRACE] [ng.shelly.internal.api.ShellyHttpApi] - : HTTP GET for http://192.168.42.61/settings
2020-03-09 20:04:33.189 [TRACE] [ng.shelly.internal.api.ShellyHttpApi] - HTTP response from : {"device":{"type":"SHSW-1","mac":"BCDDC28B18A1","hostname":"shelly1-8B18A1","num_outputs":1},"wifi_ap":{"enabled":false,"ssid":"shelly1-8B18A1","key":""},"wifi_sta":{"enabled":true,"ssid":"IoT","ipv4_method":"dhcp","ip":null,"gw":null,"mask":null,"dns":null},"wifi_sta1":{"enabled":false,"ssid":null,"ipv4_method":"dhcp","ip":null,"gw":null,"mask":null,"dns":null},"mqtt": {"enable":true,"server":"hub.home:1883","user":"","id":"shelly1-8B18A1","reconnect_timeout_max":60.000000,"reconnect_timeout_min":2.000000,"clean_session":true,"keep_alive":60,"max_qos":0,"retain":false,"update_period":30},"coiot": {"update_period":15},"sntp":{"server":"time.google.com","enabled":true},"login":{"enabled":false,"unprotected":false,"username":"admin","password":"admin"},"pin_code":"","name":"","fw":"20200309-104024/v1.6.0@43056d58","factory_reset_from_switch":true,"discoverable":true,"build_info":{"build_id":"20200309-104024/v1.6.0@43056d58","build_timestamp":"2020-03-09T10:40:24Z","build_version":"1.0"},"cloud":{"enabled":false,"connected":false},"timezone":"Europe/Budapest","lat":47.500000,"lng":19.083300,"tzautodetect":true,"tz_utc_offset":3600,"tz_dst":false,"tz_dst_auto":true,"time":"20:04","unixtime":1583784273,"hwinfo":{"hw_revision":"prod-2018-08", "batch_id":2},"mode" :"relay","longpush_time":800,"relays":[{"name":null,"ison":false,"has_timer":false,"default_state":"last","btn_type":"momentary","btn_reverse":1,"auto_on":0.00,"auto_off":20.00,"power":0.00,"btn_on_url":null,"btn_off_url":null,"out_on_url":"http://192.168.42.236:8080/shelly/event/shelly1-8b18a1/relay/0?type=out_on","out_off_url":"http://192.168.42.236:8080/shelly/event/shelly1-8b18a1/relay/0?type=out_off","longpush_url":"http://192.168.1.33:8080/shelly/event/shelly1-8b18a1/relay/0?type=longpush","shortpush_url":null,"schedule":false,"schedule_rules":[]}],"ext_sensors":{},"ext_temperature":[],"ext_humidity":[]}
2020-03-09 20:04:33.192 [DEBUG] [discovery.ShellyDiscoveryParticipant] - Shelly settings : {"device":{"type":"SHSW-1","mac":"BCDDC28B18A1","hostname":"shelly1-8B18A1","num_outputs":1},"wifi_ap":{"enabled":false,"ssid":"shelly1-8B18A1","key":""},"wifi_sta":{"enabled":true,"ssid":"IoT","ipv4_method":"dhcp","ip":null,"gw":null,"mask":null,"dns":null},"wifi_sta1":{"enabled":false,"ssid":null,"ipv4_method":"dhcp","ip":null,"gw":null,"mask":null,"dns":null},"mqtt": {"enable":true,"server":"hub.home:1883","user":"","id":"shelly1-8B18A1","reconnect_timeout_max":60.000000,"reconnect_timeout_min":2.000000,"clean_session":true,"keep_alive":60,"max_qos":0,"retain":false,"update_period":30},"coiot": {"update_period":15},"sntp":{"server":"time.google.com","enabled":true},"login":{"enabled":false,"unprotected":false,"username":"admin","password":"admin"},"pin_code":"","name":"","fw":"20200309-104024/v1.6.0@43056d58","factory_reset_from_switch":true,"discoverable":true,"build_info":{"build_id":"20200309-104024/v1.6.0@43056d58","build_timestamp":"2020-03-09T10:40:24Z","build_version":"1.0"},"cloud":{"enabled":false,"connected":false},"timezone":"Europe/Budapest","lat":47.500000,"lng":19.083300,"tzautodetect":true,"tz_utc_offset":3600,"tz_dst":false,"tz_dst_auto":true,"time":"20:04","unixtime":1583784273,"hwinfo":{"hw_revision":"prod-2018-08", "batch_id":2},"mode" :"relay","longpush_time":800,"relays":[{"name":null,"ison":false,"has_timer":false,"default_state":"last","btn_type":"momentary","btn_reverse":1,"auto_on":0.00,"auto_off":20.00,"power":0.00,"btn_on_url":null,"btn_off_url":null,"out_on_url":"http://192.168.42.236:8080/shelly/event/shelly1-8b18a1/relay/0?type=out_on","out_off_url":"http://192.168.42.236:8080/shelly/event/shelly1-8b18a1/relay/0?type=out_off","longpush_url":"http://192.168.1.33:8080/shelly/event/shelly1-8b18a1/relay/0?type=longpush","shortpush_url":null,"schedule":false,"schedule_rules":[]}],"ext_sensors":{},"ext_temperature":[],"ext_humidity":[]}
2020-03-09 20:04:33.199 [TRACE] [discovery.ShellyDiscoveryParticipant] - name=shelly1-8b18a1, thingType=, deviceType=SHSW-1, mode=relay
2020-03-09 20:04:33.200 [DEBUG] [discovery.ShellyDiscoveryParticipant] - Adding Shelly thing, UID=shelly:shelly1:8b18a1
...
...
2020-03-09 20:04:34.006 [DEBUG] [y.internal.handler.ShellyBaseHandler] - shelly test: Device config: ipAddress=192.168.42.61, http user/password=<non>/<none>, update interval=60
2020-03-09 20:04:34.008 [DEBUG] [y.internal.handler.ShellyBaseHandler] - shelly1: Start initializing thing shelly test, type shelly1, ip address 192.168.42.61, CoIoT: false
2020-03-09 20:04:34.008 [TRACE] [ng.shelly.internal.api.ShellyHttpApi] - : HTTP GET for http://192.168.42.61/settings
2020-03-09 20:04:34.181 [TRACE] [ng.shelly.internal.api.ShellyHttpApi] - HTTP response from : {"device":{"type":"SHSW-1","mac":"BCDDC28B18A1","hostname":"shelly1-8B18A1","num_outputs":1},"wifi_ap":{"enabled":false,"ssid":"shelly1-8B18A1","key":""},"wifi_sta":{"enabled":true,"ssid":"IoT","ipv4_method":"dhcp","ip":null,"gw":null,"mask":null,"dns":null},"wifi_sta1":{"enabled":false,"ssid":null,"ipv4_method":"dhcp","ip":null,"gw":null,"mask":null,"dns":null},"mqtt": {"enable":true,"server":"hub.home:1883","user":"","id":"shelly1-8B18A1","reconnect_timeout_max":60.000000,"reconnect_timeout_min":2.000000,"clean_session":true,"keep_alive":60,"max_qos":0,"retain":false,"update_period":30},"coiot": {"update_period":15},"sntp":{"server":"time.google.com","enabled":true},"login":{"enabled":false,"unprotected":false,"username":"admin","password":"admin"},"pin_code":"","name":"","fw":"20200309-104024/v1.6.0@43056d58","factory_reset_from_switch":true,"discoverable":true,"build_info":{"build_id":"20200309-104024/v1.6.0@43056d58","build_timestamp":"2020-03-09T10:40:24Z","build_version":"1.0"},"cloud":{"enabled":false,"connected":false},"timezone":"Europe/Budapest","lat":47.500000,"lng":19.083300,"tzautodetect":true,"tz_utc_offset":3600,"tz_dst":false,"tz_dst_auto":true,"time":"20:04","unixtime":1583784274,"hwinfo":{"hw_revision":"prod-2018-08", "batch_id":2},"mode" :"relay","longpush_time":800,"relays":[{"name":null,"ison":false,"has_timer":false,"default_state":"last","btn_type":"momentary","btn_reverse":1,"auto_on":0.00,"auto_off":20.00,"power":0.00,"btn_on_url":null,"btn_off_url":null,"out_on_url":"http://192.168.42.236:8080/shelly/event/shelly1-8b18a1/relay/0?type=out_on","out_off_url":"http://192.168.42.236:8080/shelly/event/shelly1-8b18a1/relay/0?type=out_off","longpush_url":"http://192.168.1.33:8080/shelly/event/shelly1-8b18a1/relay/0?type=longpush","shortpush_url":null,"schedule":false,"schedule_rules":[]}],"ext_sensors":{},"ext_temperature":[],"ext_humidity":[]}
2020-03-09 20:04:34.191 [DEBUG] [y.internal.handler.ShellyBaseHandler] - shelly1: Initializing device shelly1-8b18a1, type SHSW-1, Hardware: Rev: prod-2018-08, batch 2; Firmware: v1.6.0 / 20200309-104024 (43056d58)
2020-03-09 20:04:34.192 [DEBUG] [y.internal.handler.ShellyBaseHandler] - shelly1: Shelly settings info: {"device":{"type":"SHSW-1","mac":"BCDDC28B18A1","hostname":"shelly1-8B18A1","num_outputs":1},"wifi_ap":{"enabled":false,"ssid":"shelly1-8B18A1","key":""},"wifi_sta":{"enabled":true,"ssid":"IoT","ipv4_method":"dhcp","ip":null,"gw":null,"mask":null,"dns":null},"wifi_sta1":{"enabled":false,"ssid":null,"ipv4_method":"dhcp","ip":null,"gw":null,"mask":null,"dns":null},"mqtt": {"enable":true,"server":"hub.home:1883","user":"","id":"shelly1-8B18A1","reconnect_timeout_max":60.000000,"reconnect_timeout_min":2.000000,"clean_session":true,"keep_alive":60,"max_qos":0,"retain":false,"update_period":30},"coiot": {"update_period":15},"sntp":{"server":"time.google.com","enabled":true},"login":{"enabled":false,"unprotected":false,"username":"admin","password":"admin"},"pin_code":"","name":"","fw":"20200309-104024/v1.6.0@43056d58","factory_reset_from_switch":true,"discoverable":true,"build_info":{"build_id":"20200309-104024/v1.6.0@43056d58","build_timestamp":"2020-03-09T10:40:24Z","build_version":"1.0"},"cloud":{"enabled":false,"connected":false},"timezone":"Europe/Budapest","lat":47.500000,"lng":19.083300,"tzautodetect":true,"tz_utc_offset":3600,"tz_dst":false,"tz_dst_auto":true,"time":"20:04","unixtime":1583784274,"hwinfo":{"hw_revision":"prod-2018-08", "batch_id":2},"mode" :"relay","longpush_time":800,"relays":[{"name":null,"ison":false,"has_timer":false,"default_state":"last","btn_type":"momentary","btn_reverse":1,"auto_on":0.00,"auto_off":20.00,"power":0.00,"btn_on_url":null,"btn_off_url":null,"out_on_url":"http://192.168.42.236:8080/shelly/event/shelly1-8b18a1/relay/0?type=out_on","out_off_url":"http://192.168.42.236:8080/shelly/event/shelly1-8b18a1/relay/0?type=out_off","longpush_url":"http://192.168.1.33:8080/shelly/event/shelly1-8b18a1/relay/0?type=longpush","shortpush_url":null,"schedule":false,"schedule_rules":[]}],"ext_sensors":{},"ext_temperature":[],"ext_humidity":[]}
2020-03-09 20:04:34.193 [DEBUG] [y.internal.handler.ShellyBaseHandler] - shelly1-8b18a1: Device has relays: true (numRelays=1, is roller: false (numRoller=0), is Plug S: false, is Dimmer: false, has LEDs: false, is Light: false, has Meter: false (numMeter=0, EMeter: false), is Sensor: false, is Sense: false, has Battery: false , event urls: btn:true,out:true,pushtrue,roller:false,sensor:false
2020-03-09 20:04:34.194 [TRACE] [ng.shelly.internal.api.ShellyHttpApi] - : HTTP GET for http://192.168.42.61/status
2020-03-09 20:04:34.255 [TRACE] [ng.shelly.internal.api.ShellyHttpApi] - HTTP response from : {"wifi_sta":{"connected":true,"ssid":"IoT","ip":"192.168.42.61","rssi":-63},"cloud":{"enabled":false,"connected":false},"mqtt":{"connected":true},"time":"20:04","unixtime":1583784274,"serial":1,"has_update":false,"mac":"BCDDC28B18A1","relays" :[{"ison":false, "has_timer":false, "timer_remaining":0}],"meters":[{"power":0.00,"is_valid":"true"}],"inputs":[{"input":1}],"ext_sensors":{},"ext_temperature":{},"ext_humidity":{},"update":{"status":"idle","has_update":false,"new_version":"20200309-104024/v1.6.0@43056d58","old_version":"20200309-104024/v1.6.0@43056d58"},"ram_total":50568,"ram_free":39524,"fs_size":233681,"fs_free":153361,"uptime":6450}
2020-03-09 20:04:34.277 [TRACE] [y.internal.handler.ShellyBaseHandler] - shelly1: Updated serrviceName to shelly1-8b18a1
2020-03-09 20:04:34.285 [TRACE] [y.internal.handler.ShellyBaseHandler] - shelly1: Properties updated
2020-03-09 20:04:34.286 [TRACE] [ng.shelly.internal.api.ShellyHttpApi] - : HTTP GET for http://192.168.42.61/settings/relay/0?out_on_url=http%3A%2F%2F192.168.42.236%3A8080%2Fshelly%2Fevent%2Fshelly1-8b18a1%2Frelay%2F0%3Ftype%3Dout_on
2020-03-09 20:04:34.487 [TRACE] [ng.shelly.internal.api.ShellyHttpApi] - HTTP response from : {"name":null,"ison":false,"has_timer":false,"default_state":"last","btn_type":"momentary","btn_reverse":1,"auto_on":0.00,"auto_off":20.00,"power":0.00,"btn_on_url":null,"btn_off_url":null,"out_on_url":"http://192.168.42.236:8080/shelly/event/shelly1-8b18a1/relay/0?type=out_on","out_off_url":"http://192.168.42.236:8080/shelly/event/shelly1-8b18a1/relay/0?type=out_off","longpush_url":"http://192.168.1.33:8080/shelly/event/shelly1-8b18a1/relay/0?type=longpush","shortpush_url":null,"schedule":false,"schedule_rules":[]}
2020-03-09 20:04:34.488 [TRACE] [ng.shelly.internal.api.ShellyHttpApi] - : HTTP GET for http://192.168.42.61/settings/relay/0?out_off_url=http%3A%2F%2F192.168.42.236%3A8080%2Fshelly%2Fevent%2Fshelly1-8b18a1%2Frelay%2F0%3Ftype%3Dout_off
2020-03-09 20:04:34.683 [TRACE] [ng.shelly.internal.api.ShellyHttpApi] - HTTP response from : {"name":null,"ison":false,"has_timer":false,"default_state":"last","btn_type":"momentary","btn_reverse":1,"auto_on":0.00,"auto_off":20.00,"power":0.00,"btn_on_url":null,"btn_off_url":null,"out_on_url":"http://192.168.42.236:8080/shelly/event/shelly1-8b18a1/relay/0?type=out_on","out_off_url":"http://192.168.42.236:8080/shelly/event/shelly1-8b18a1/relay/0?type=out_off","longpush_url":"http://192.168.1.33:8080/shelly/event/shelly1-8b18a1/relay/0?type=longpush","shortpush_url":null,"schedule":false,"schedule_rules":[]}
2020-03-09 20:04:34.699 [TRACE] [y.internal.handler.ShellyBaseHandler] - shelly1: Channel device#uptime updated with 6450 s (type class org.eclipse.smarthome.core.library.types.QuantityType).
2020-03-09 20:04:34.700 [TRACE] [y.internal.handler.ShellyBaseHandler] - shelly1: Channel device#wifiSignal updated with 3 (type class org.eclipse.smarthome.core.library.types.DecimalType).
2020-03-09 20:04:34.702 [TRACE] [y.internal.handler.ShellyBaseHandler] - shelly1: Properties updated
2020-03-09 20:04:34.702 [DEBUG] [y.internal.handler.ShellyBaseHandler] - shelly1: Thing successfully initialized.
2020-03-09 20:04:34.704 [DEBUG] [y.internal.handler.ShellyBaseHandler] - shelly1: Update status job started, interval=20*3=60sec.
2020-03-09 20:04:36.704 [TRACE] [y.internal.handler.ShellyBaseHandler] - shelly1: Updating status
2020-03-09 20:04:36.706 [TRACE] [ng.shelly.internal.api.ShellyHttpApi] - : HTTP GET for http://192.168.42.61/status
2020-03-09 20:04:36.792 [TRACE] [ng.shelly.internal.api.ShellyHttpApi] - HTTP response from : {"wifi_sta":{"connected":true,"ssid":"IoT","ip":"192.168.42.61","rssi":-63},"cloud":{"enabled":false,"connected":false},"mqtt":{"connected":true},"time":"20:04","unixtime":1583784277,"serial":1,"has_update":false,"mac":"BCDDC28B18A1","relays" :[{"ison":false, "has_timer":false, "timer_remaining":0}],"meters":[{"power":0.00,"is_valid":"true"}],"inputs":[{"input":1}],"ext_sensors":{},"ext_temperature":{},"ext_humidity":{},"update":{"status":"idle","has_update":false,"new_version":"20200309-104024/v1.6.0@43056d58","old_version":"20200309-104024/v1.6.0@43056d58"},"ram_total":50568,"ram_free":38872,"fs_size":233681,"fs_free":153361,"uptime":6452}
2020-03-09 20:04:36.795 [TRACE] [.internal.handler.ShellyRelayHandler] - shelly1: Updating 1 relay(s)
2020-03-09 20:04:36.796 [TRACE] [ng.shelly.internal.api.ShellyHttpApi] - : HTTP GET for http://192.168.42.61/status/relay/0
2020-03-09 20:04:36.859 [TRACE] [ng.shelly.internal.api.ShellyHttpApi] - HTTP response from : {"wifi_sta":{"connected":true,"ssid":"IoT","ip":"192.168.42.61","rssi":-63},"cloud":{"enabled":false,"connected":false},"mqtt":{"connected":true},"time":"20:04","unixtime":1583784277,"serial":1,"has_update":false,"mac":"BCDDC28B18A1","relays" :[{"ison":false, "has_timer":false, "timer_remaining":0}],"meters":[{"power":0.00,"is_valid":"true"}],"inputs":[{"input":1}],"ext_sensors":{},"ext_temperature":{},"ext_humidity":{},"update":{"status":"idle","has_update":false,"new_version":"20200309-104024/v1.6.0@43056d58","old_version":"20200309-104024/v1.6.0@43056d58"},"ram_total":50568,"ram_free":39012,"fs_size":233681,"fs_free":153361,"uptime":6452}
2020-03-09 20:04:36.867 [TRACE] [y.internal.handler.ShellyBaseHandler] - shelly1: Channel relay#output updated with OFF (type class org.eclipse.smarthome.core.library.types.OnOffType).
2020-03-09 20:04:36.867 [TRACE] [y.internal.handler.ShellyBaseHandler] - shelly1: Channel relay#timerActive updated with OFF (type class org.eclipse.smarthome.core.library.types.OnOffType).
2020-03-09 20:04:36.868 [TRACE] [y.internal.handler.ShellyBaseHandler] - shelly1: Channel relay#autoOn updated with 0.0 s (type class org.eclipse.smarthome.core.library.types.QuantityType).
2020-03-09 20:04:36.869 [TRACE] [y.internal.handler.ShellyBaseHandler] - shelly1: Channel relay#autoOff updated with 20.0 s (type class org.eclipse.smarthome.core.library.types.QuantityType).
2020-03-09 20:04:36.871 [TRACE] [y.internal.handler.ShellyBaseHandler] - shelly1: Updating input[0] with ON
2020-03-09 20:04:36.871 [TRACE] [y.internal.handler.ShellyBaseHandler] - shelly1: Channel relay#input updated with ON (type class org.eclipse.smarthome.core.library.types.OnOffType).
2020-03-09 20:04:36.874 [DEBUG] [y.internal.handler.ShellyBaseHandler] - shelly1: 2 more updates requested
...
2020-03-09 20:04:39.875 [TRACE] [y.internal.handler.ShellyBaseHandler] - shelly1: Updating status
2020-03-09 20:04:39.877 [TRACE] [ng.shelly.internal.api.ShellyHttpApi] - : HTTP GET for http://192.168.42.61/status
2020-03-09 20:04:39.940 [TRACE] [ng.shelly.internal.api.ShellyHttpApi] - HTTP response from : {"wifi_sta":{"connected":true,"ssid":"IoT","ip":"192.168.42.61","rssi":-63},"cloud":{"enabled":false,"connected":false},"mqtt":{"connected":true},"time":"20:04","unixtime":1583784280,"serial":1,"has_update":false,"mac":"BCDDC28B18A1","relays" :[{"ison":false, "has_timer":false, "timer_remaining":0}],"meters":[{"power":0.00,"is_valid":"true"}],"inputs":[{"input":1}],"ext_sensors":{},"ext_temperature":{},"ext_humidity":{},"update":{"status":"idle","has_update":false,"new_version":"20200309-104024/v1.6.0@43056d58","old_version":"20200309-104024/v1.6.0@43056d58"},"ram_total":50568,"ram_free":39020,"fs_size":233681,"fs_free":153361,"uptime":6455}
2020-03-09 20:04:39.943 [TRACE] [.internal.handler.ShellyRelayHandler] - shelly1: Updating 1 relay(s)
2020-03-09 20:04:39.944 [TRACE] [ng.shelly.internal.api.ShellyHttpApi] - : HTTP GET for http://192.168.42.61/status/relay/0
2020-03-09 20:04:40.007 [TRACE] [ng.shelly.internal.api.ShellyHttpApi] - HTTP response from : {"wifi_sta":{"connected":true,"ssid":"IoT","ip":"192.168.42.61","rssi":-63},"cloud":{"enabled":false,"connected":false},"mqtt":{"connected":true},"time":"20:04","unixtime":1583784280,"serial":1,"has_update":false,"mac":"BCDDC28B18A1","relays" :[{"ison":false, "has_timer":false, "timer_remaining":0}],"meters":[{"power":0.00,"is_valid":"true"}],"inputs":[{"input":1}],"ext_sensors":{},"ext_temperature":{},"ext_humidity":{},"update":{"status":"idle","has_update":false,"new_version":"20200309-104024/v1.6.0@43056d58","old_version":"20200309-104024/v1.6.0@43056d58"},"ram_total":50568,"ram_free":38840,"fs_size":233681,"fs_free":153361,"uptime":6455}
2020-03-09 20:04:40.010 [TRACE] [y.internal.handler.ShellyBaseHandler] - shelly1: Channel relay#output updated with OFF (type class org.eclipse.smarthome.core.library.types.OnOffType).
2020-03-09 20:04:40.011 [TRACE] [y.internal.handler.ShellyBaseHandler] - shelly1: Channel relay#timerActive updated with OFF (type class org.eclipse.smarthome.core.library.types.OnOffType).
2020-03-09 20:04:40.012 [TRACE] [y.internal.handler.ShellyBaseHandler] - shelly1: Channel relay#autoOn updated with 0.0 s (type class org.eclipse.smarthome.core.library.types.QuantityType).
2020-03-09 20:04:40.014 [TRACE] [y.internal.handler.ShellyBaseHandler] - shelly1: Channel relay#autoOff updated with 20.0 s (type class org.eclipse.smarthome.core.library.types.QuantityType).
2020-03-09 20:04:40.014 [TRACE] [y.internal.handler.ShellyBaseHandler] - shelly1: Updating input[0] with ON
2020-03-09 20:04:40.015 [TRACE] [y.internal.handler.ShellyBaseHandler] - shelly1: Channel relay#input updated with ON (type class org.eclipse.smarthome.core.library.types.OnOffType).
2020-03-09 20:04:40.015 [DEBUG] [y.internal.handler.ShellyBaseHandler] - shelly1: 1 more updates requested
...
2020-03-09 20:04:43.016 [TRACE] [y.internal.handler.ShellyBaseHandler] - shelly1: Updating status
2020-03-09 20:04:43.017 [TRACE] [ng.shelly.internal.api.ShellyHttpApi] - : HTTP GET for http://192.168.42.61/status
2020-03-09 20:04:43.092 [TRACE] [ng.shelly.internal.api.ShellyHttpApi] - HTTP response from : {"wifi_sta":{"connected":true,"ssid":"IoT","ip":"192.168.42.61","rssi":-63},"cloud":{"enabled":false,"connected":false},"mqtt":{"connected":true},"time":"20:04","unixtime":1583784283,"serial":1,"has_update":false,"mac":"BCDDC28B18A1","relays" :[{"ison":false, "has_timer":false, "timer_remaining":0}],"meters":[{"power":0.00,"is_valid":"true"}],"inputs":[{"input":1}],"ext_sensors":{},"ext_temperature":{},"ext_humidity":{},"update":{"status":"idle","has_update":false,"new_version":"20200309-104024/v1.6.0@43056d58","old_version":"20200309-104024/v1.6.0@43056d58"},"ram_total":50568,"ram_free":39016,"fs_size":233681,"fs_free":153361,"uptime":6458}
2020-03-09 20:04:43.094 [TRACE] [.internal.handler.ShellyRelayHandler] - shelly1: Updating 1 relay(s)
2020-03-09 20:04:43.094 [TRACE] [ng.shelly.internal.api.ShellyHttpApi] - : HTTP GET for http://192.168.42.61/status/relay/0
2020-03-09 20:04:43.155 [TRACE] [ng.shelly.internal.api.ShellyHttpApi] - HTTP response from : {"wifi_sta":{"connected":true,"ssid":"IoT","ip":"192.168.42.61","rssi":-63},"cloud":{"enabled":false,"connected":false},"mqtt":{"connected":true},"time":"20:04","unixtime":1583784283,"serial":1,"has_update":false,"mac":"BCDDC28B18A1","relays" :[{"ison":false, "has_timer":false, "timer_remaining":0}],"meters":[{"power":0.00,"is_valid":"true"}],"inputs":[{"input":1}],"ext_sensors":{},"ext_temperature":{},"ext_humidity":{},"update":{"status":"idle","has_update":false,"new_version":"20200309-104024/v1.6.0@43056d58","old_version":"20200309-104024/v1.6.0@43056d58"},"ram_total":50568,"ram_free":39176,"fs_size":233681,"fs_free":153361,"uptime":6458}
2020-03-09 20:04:43.157 [TRACE] [y.internal.handler.ShellyBaseHandler] - shelly1: Channel relay#output updated with OFF (type class org.eclipse.smarthome.core.library.types.OnOffType).
2020-03-09 20:04:43.158 [TRACE] [y.internal.handler.ShellyBaseHandler] - shelly1: Channel relay#timerActive updated with OFF (type class org.eclipse.smarthome.core.library.types.OnOffType).
2020-03-09 20:04:43.159 [TRACE] [y.internal.handler.ShellyBaseHandler] - shelly1: Channel relay#autoOn updated with 0.0 s (type class org.eclipse.smarthome.core.library.types.QuantityType).
2020-03-09 20:04:43.160 [TRACE] [y.internal.handler.ShellyBaseHandler] - shelly1: Channel relay#autoOff updated with 20.0 s (type class org.eclipse.smarthome.core.library.types.QuantityType).
2020-03-09 20:04:43.161 [TRACE] [y.internal.handler.ShellyBaseHandler] - shelly1: Updating input[0] with ON
2020-03-09 20:04:43.162 [TRACE] [y.internal.handler.ShellyBaseHandler] - shelly1: Channel relay#input updated with ON (type class org.eclipse.smarthome.core.library.types.OnOffType).
2020-03-09 20:04:43.163 [TRACE] [y.internal.handler.ShellyBaseHandler] - shelly1: Channel device#uptime updated with 6458 s (type class org.eclipse.smarthome.core.library.types.QuantityType).
2020-03-09 20:04:43.163 [TRACE] [y.internal.handler.ShellyBaseHandler] - shelly1: Channel device#wifiSignal updated with 3 (type class org.eclipse.smarthome.core.library.types.DecimalType).
2020-03-09 20:04:43.163 [DEBUG] [y.internal.handler.ShellyBaseHandler] - shelly1: 0 more updates requested
```
Log of callbacks:
```
2020-03-09 20:26:59.029 [DEBUG] [elly.internal.api.ShellyEventServlet] - CallbackServlet: HTTP/1.1 Request from 192.168.42.61:37347/shelly/event/shelly1-8b18a1/relay/0?{type=[out_on]}
2020-03-09 20:26:59.030 [TRACE] [elly.internal.api.ShellyEventServlet] - Process event of type type=relay for device shelly1-8b18a1, index=0
2020-03-09 20:26:59.030 [TRACE] [shelly.internal.ShellyHandlerFactory] - Dispatch event to device handler shelly1-8b18a1
2020-03-09 20:27:19.039 [DEBUG] [elly.internal.api.ShellyEventServlet] - CallbackServlet: HTTP/1.1 Request from 192.168.42.61:37348/shelly/event/shelly1-8b18a1/relay/0?{type=[out_off]}
2020-03-09 20:27:19.040 [TRACE] [elly.internal.api.ShellyEventServlet] - Process event of type type=relay for device shelly1-8b18a1, index=0
2020-03-09 20:27:19.040 [TRACE] [shelly.internal.ShellyHandlerFactory] - Dispatch event to device handler shelly1-8b18a1
```

**Comment by hmerk** [comment]
what‘s your firmware version?

**Comment by englishman-hu** [comment]
As you can see it in the log and in the opening message, it's 1.6.0.

**Comment by hmerk** [comment]
Sorry, did not see it. Are you using the latest dev version of the binding?
It is optimised for fw 1.6

**Comment by englishman-hu** [comment]
no, it's the one bundled with 2.5.1 release build
I tried it with 1.5.0 firmware, and the result was the same. The shelly sent the correct callback, but the binding received and ignored it.

**Comment by hmerk** [comment]
Fw 1.5 was not supported AFAIK, binding started with 1.5.2

**Comment by englishman-hu** [comment]
...which is a non-existing version for shelly1(v2).
The 1.5.0 was the latest available till today, when the 1.6.0 came out.

**Comment by hmerk** [comment]
No, mine are running at 1.5.7 or 1.5.9 or 1.5.10

**Comment by hmerk** [comment]
If 1.6.0 is out, please update to latest dev version, see forum post

**Comment by englishman-hu** [comment]
Seeing the helpfulness, I think I am not going to tinker a dev repo into my docker environment, but rather revert to mqtt which works fine...

**Comment by hmerk** [comment]
No tinkering needed, just update the binding with the jar linked in the community post.

**Comment by hmerk** [comment]
Closing this issue now as it seems to be a mismatch between required firmware version and binding version.

**Comment by englishman-hu** [comment]
I highlighted that the binding received the **_correct callback_** but it was ignored - just like my explanation :(


The device sent the callback url as the binding configured it.

Binding configured the callback url on device:
```
2020-03-09 20:04:34.286 [TRACE] [ng.shelly.internal.api.ShellyHttpApi] - : HTTP GET for http://192.168.42.61/settings/relay/0?out_on_url=http%3A%2F%2F192.168.42.236%3A8080%2Fshelly%2Fevent%2Fshelly1-8b18a1%2Frelay%2F0%3Ftype%3Dout_on
...
2020-03-09 20:04:34.488 [TRACE] [ng.shelly.internal.api.ShellyHttpApi] - : HTTP GET for http://192.168.42.61/settings/relay/0?out_off_url=http%3A%2F%2F192.168.42.236%3A8080%2Fshelly%2Fevent%2Fshelly1-8b18a1%2Frelay%2F0%3Ftype%3Dout_off
```

...and the device sent exactly those:
```
les@bay:~$ sudo tcpdump host shelly2 and port 8080
...
19:36:06.418452 IP shelly2.home.37378 > bay.http-alt: Flags [P.], seq 1:112, ack 1, win 5840, length 111: HTTP: GET /shelly/event/shelly1-8b18a1/relay/0?type=out_on HTTP/1.1
...
19:36:06.422563 IP bay.http-alt > shelly2.home.37378: Flags [P.], seq 1:72, ack 112, win 29200, length 71: HTTP: HTTP/1.1 200 OK
...
...
19:36:07.045225 IP shelly2.home.37379 > bay.http-alt: Flags [P.], seq 1:113, ack 1, win 5840, length 112: HTTP: GET /shelly/event/shelly1-8b18a1/relay/0?type=out_off HTTP/1.1
...
19:36:07.049302 IP bay.http-alt > shelly2.home.37379: Flags [P.], seq 1:72, ack 113, win 29200, length 71: HTTP: HTTP/1.1 200 OK
```
...which was received by the binding:
```
2020-03-10 19:36:06.420 [DEBUG] [elly.internal.api.ShellyEventServlet] - CallbackServlet: HTTP/1.1 Request from 192.168.42.61:37378/shelly/event/shelly1-8b18a1/relay/0?{type=[out_on]}
2020-03-10 19:36:06.421 [TRACE] [elly.internal.api.ShellyEventServlet] - Process event of type type=relay for device shelly1-8b18a1, index=0
2020-03-10 19:36:06.422 [TRACE] [shelly.internal.ShellyHandlerFactory] - Dispatch event to device handler shelly1-8b18a1
2020-03-10 19:36:07.047 [DEBUG] [elly.internal.api.ShellyEventServlet] - CallbackServlet: HTTP/1.1 Request from 192.168.42.61:37379/shelly/event/shelly1-8b18a1/relay/0?{type=[out_off]}
2020-03-10 19:36:07.047 [TRACE] [elly.internal.api.ShellyEventServlet] - Process event of type type=relay for device shelly1-8b18a1, index=0
2020-03-10 19:36:07.048 [TRACE] [shelly.internal.ShellyHandlerFactory] - Dispatch event to device handler shelly1-8b18a1
```

**Comment by hmerk** [comment]
Yes, but you seem not be willing to test the latest version.
The binding docs clearly say that firmware version 1.5.2 and above is required, so no gurantee tow work with 1.5.0
Firmware 1.6.0 is completely new and has some additional features which require the lates dev build of the binding published in the community thread.
Many users reported the callbacks working. So it might be worth to discuss your issue in the community first before reporting a bug.

**Comment by englishman-hu** [comment]
Not much of a luck with the latest snapshot...

```
2020-03-11 00:11:44.193 [WARN ] [org.apache.felix.fileinstall        ] - Error while starting bundle: file:/openhab/addons/org.openhab.binding.shelly-2.5.2-SNAPSHOT.jar
org.osgi.framework.BundleException: Could not resolve module: org.openhab.binding.shelly [203]
  Unresolved requirement: Import-Package: org.eclipse.californium.core; version="[2.0.0,3.0.0)"

        at org.eclipse.osgi.container.Module.start(Module.java:444) ~[org.eclipse.osgi-3.12.100.jar:?]
        at org.eclipse.osgi.internal.framework.EquinoxBundle.start(EquinoxBundle.java:383) ~[org.eclipse.osgi-3.12.100.jar:?]     
        at org.apache.felix.fileinstall.internal.DirectoryWatcher.startBundle(DirectoryWatcher.java:1260) [bundleFile:3.6.4]      
        at org.apache.felix.fileinstall.internal.DirectoryWatcher.startBundles(DirectoryWatcher.java:1233) [bundleFile:3.6.4]     
        at org.apache.felix.fileinstall.internal.DirectoryWatcher.doProcess(DirectoryWatcher.java:520) [bundleFile:3.6.4]
        at org.apache.felix.fileinstall.internal.DirectoryWatcher.process(DirectoryWatcher.java:365) [bundleFile:3.6.4]
        at org.apache.felix.fileinstall.internal.DirectoryWatcher.run(DirectoryWatcher.java:316) [bundleFile:3.6.4]
```

**Comment by englishman-hu** [comment]
Managed the snapshot binding to work.
That works provided the thing id is set to the device id (last 6 digits of MAC), but doesn't if I give the thing a meaningful id.
This is still against to the OH thing naming concept - so I consider it a bug.
Shall we close this one and I open a new or, shall we keep this?

**Comment by hmerk** [comment]
Yes, please close this one, as what you describe is totally different.
I would assume that discovery and handler factory are missing the representation property, which should be easy to fix, guess 4 lines of code...

**Comment by englishman-hu** [comment]
I was too fast in confirming :(
Having installed the binding files, it worked, but after restarting OH, I got the issue again.

I could not get it working again ever since...

**Comment by hmerk** [comment]
Anything in the logs ????

**Comment by englishman-hu** [comment]
I see the callbacks received and dispatched, like I quoted before. Just no update made to the items.

**Comment by markus7017** [comment]
Fixed with PR #6985 

You should prefer CoIoT events over Action URLs. New version enables them by default.
