### ISSUE TITLE
[tradfri] Can no longer control things from within OH

### ISSUE THREAD

**Issue by shutterfreak** [openhab/openhab-addons#6023]
It appears that recent snapshots have a problem sending commands to TRADFRI things. Not sure if this is related to the most recent commit of the TRADFRI binding or whether it has to do with recent changes in core.

I'm currently on openHAB 2.5.0 Build #1678 but the issue already occurred on earlier snapshots (more or less since Milestone build 2 was released). The TRADFRI gateway runs the latest firmware (1.8.26).

Basically, everything (sort of) works except sending commands to the TRADFRI things. 

Discussion:
https://community.openhab.org/t/cannot-control-tradfri-things-anymore-from-within-oh2/81277

**Comment by shutterfreak** [comment]
The only "fix" is power cycling the Tradfri gateway.

**Comment by wborn** [comment]
Have you also seen this issue @cweitkamp?

**Comment by cweitkamp** [comment]
I am afraid I cannot help much on TRADFRI problems anymore because I get rid of the TRADFRI Gateway from my home. Currently I am using deCONZ for all of my Zigbee devices except lightning.

**Comment by wborn** [comment]
Thanks for the heads up! Would it then also make sense to remove you as maintainer for that binding?

Maybe @kaikreuzer also knows if this is an issue?

**Comment by kaikreuzer** [comment]
Same situation for me: I don't use the TRADFRI gateway at home...

**Comment by cweitkamp** [comment]
@shutterfreak Is this still an issue for you? You marked the [related community thread](https://community.openhab.org/t/cannot-control-tradfri-things-anymore-from-within-oh2/81277/6) as solved.

> Would it then also make sense to remove you as maintainer for that binding?

I neither will not vote against that nor force someone to do it :wink: .

I maybe will reactivate it once the FYRTUR blinds are available in german stores... No promise.

**Comment by wborn** [comment]
If you still have the devices you're still in a good position to resume work on it some day. :slightly_smiling_face:

**Comment by wborn** [comment]
Is this the same issue as reported in https://github.com/openhab/openhab2-addons/issues/5489 @shutterfreak ?

**Comment by chriscolden** [comment]
its early days but you might want to review the last few posts on this thread. https://community.openhab.org/t/tradfri-ignoring-unmatchable-piggy-backed-response-from-x-x-x-x-5684/79469/23

**Comment by shutterfreak** [comment]
> @shutterfreak Is this still an issue for you? You marked the [related community thread](https://community.openhab.org/t/cannot-control-tradfri-things-anymore-from-within-oh2/81277/6) as solved.
> 
> > Would it then also make sense to remove you as maintainer for that binding?
> 
> I neither will not vote against that nor force someone to do it 😉 .
> 
> I maybe will reactivate it once the FYRTUR blinds are available in german stores... No promise.

I moved away from snapshot builds after my TRADFRI woes and am running milestone builds again (2.5M3).

Is it okay that wait until M4 has been released, or should I go back to using snapshot builds?

**Comment by shutterfreak** [comment]
> Is this the same issue as reported in #5489 @shutterfreak ?

To me it appears to be a duplicate, indeed.

To summarize, I think there are 2 problems:
1. When the TRADFRI binding restarts, it first used the legacy access method whcih didn't work anymore with recent gateway firmware versions (should have been solved now, I infer from this thread).
1. The TRADFRI tends to hammer the TRADFRI gateway at times, resulting in an unresponsive TRADFRI gateway. The only cure is to regularly power cycle the TRADFRI gateway. I also believe that this problem occurs more frequently when the Zigbee network reaches a certain node count. I recently added a couple nodes, and since I get more frequent gateway outages. These outages are also apparent at any other app that interfaces with the TRADFRI gateway (Ikea Home Smart app, Google Home, Apple Homekit).

**Comment by chriscolden** [comment]
You can try the tradfri binding in that link i posted now. That wont use legacy auth as thats been removed already and there is a change to coap which we hope means that point 2 isnt as bad or better fixed.

**Comment by J-N-K** [comment]
@shutterfreak, how many nodes do you have? Can you "force" the gateway to come unresponsive? Iw wonder if we should keep track of the requests and rate-limit them.

**Comment by shutterfreak** [comment]
Our home currently has 23 devices: 1 dimmer, 8 remote controls, 1 motion sensor, 1 transformer (for cabinet lights), 6 warm white bulbs and 6 white spectrum bulbs.

**Comment by jordyheutinck** [comment]
We're experiencing the same unresponsiveness as described by @shutterfreak as in, openhab actions towards TRADFRI items being delayed, resulting in many on/off tries, resulting in many delayed on/off actions. But also the apparent outage and inability of the Ikea Home Smart app to connect and control the devices.
Though we have less TRADFRI devices, about 11

**Comment by shutterfreak** [comment]
We are now at 26 devices. Since last message we added one TRADFRI signal repeater that will hopefully reduce battery depletion of the remotes, and one control outlet and square on/off (new dimmer) switch.

Since the 1.9.27 firmware the TRADFRI gateway (and as a result also the TRADFRI binding) is more stable. I hope OH 2.5M4 will be deployed in the coming days so I can give the new TRADFRI binding a try and report here on the progress.

**Comment by chriscolden** [comment]
one thing ive found, is that if i unplug the network cable and plug back in on the gateway, it forces the gateway back online in openhab. Everything else continues to work with the gateway such as the app and google home, just not openhab until i do the network cable trick. This isn't a power cycle. Something flakey it would seem. Now question is, is it something the gateway doesn't like about the binding?

**Comment by shutterfreak** [comment]
Since the problem no longer appears now, I'd suggest to close this issue.

Okay?

**Comment by jannegpriv** [comment]
I still have problems with the binding and the Tradfri Gateway being Offline with Communication Error running OH 2.5.0 stable. The log shows:
```
2019-12-24 09:11:33.919 [DEBUG] [.tradfri.internal.TradfriCoapHandler] - CoAP onError
2019-12-24 09:11:33.921 [DEBUG] [.tradfri.internal.TradfriCoapHandler] - CoAP onError
2019-12-24 09:11:33.922 [DEBUG] [ternal.handler.TradfriGatewayHandler] - Gateway communication error. Forcing session resume on next command.
```
Restarting the binding gives:

```
2019-12-24 09:21:43.007 [WARN ] [iscovery.TradfriDiscoveryParticipant] - Discovered Tradfri gateway doesn't have an IP address: [ServiceInfoImpl@1530162 name: 'gw-dcefcaba3a07._coap._udp.local.' address: '(null):5684' status: 'NO DNS state: probing 1 task: null', has NO data, empty]
2019-12-24 09:26:58.772 [WARN ] [iscovery.TradfriDiscoveryParticipant] - Discovered Tradfri gateway doesn't have an IP address: [ServiceInfoImpl@3950602 name: 'gw-dcefcaba3a07._coap._udp.local.' address: '(null):0' status: 'DNS: JmDNS-/192.168.1.236 [/192.168.1.236] state: probing 1 task: null', has NO data
        gw-dcefcaba3a07._coap._udp.local.: ]
```

Restart of OH gets the bridge Online again. I have not tried the network cable trick yet.

This has happened several times since upgrading to 2.5.0 stable, also had stability problems on all milestones releases as well.

Running on FW version 1.9.27.

**Comment by J-N-K** [comment]
Is this still the case with latest ikea firmware and OH 2.5.9?

**Comment by artur3** [comment]
I have this problem: 
https://community.openhab.org/t/tradfri-1-11-47-lights-detected-but-not-controllable/106709

I solved it by adding delay in rule. But this stopped working just after openHAB update to 2.5.10, now Tradfri works works only for few minutes, hours after OH restart. Everything stays online but I have no control. 

When Tradfri works, debug shows very frequent (every minute) communication with gateway:
`2020-11-05 02:13:16.029 [DEBUG] [g.tradfri.internal.TradfriCoapClient] - CoAP GET request
2020-11-05 02:13:16.077 [DEBUG] [.tradfri.internal.TradfriCoapHandler] - CoAP response
2020-11-05 02:13:16.078 [DEBUG] [ternal.handler.TradfriGatewayHandler] - requestGatewayInfo response: {"9081":"7e2325520440000c","9023":"2.tradfri.pool.ntp.org","9059":1604538795,"9060":"2020-11-05T01:13:15.015032Z","9054":0,"9062":0,"9061":0,"9072":3,"9029":"1.11.51","9082":false,"9073":28,"9075":0,"9083":"N/A","9079":0,"9055":0,"9066":5,"9092":0,"9069":1603209985,"9071":1,"9074":1,"9080":60,"9106":0,"9076":10,"9200":"5f9a13ea-9b9c-4bdf-b950-2579b776b8b7","9118":0,"9077":31,"9078":1,"9103":"a1nvlh0fc0asuq.iot.eu-central-1.amazonaws.com","9093":0,"9107":0,"9105":0,"9201":1,"9202":1598706725}
2020-11-05 02:13:16.078 [DEBUG] [.tradfri.internal.TradfriCoapHandler] - CoAP response
2020-11-05 02:13:16.079 [DEBUG] [ternal.handler.TradfriGatewayHandler] - onUpdate response: [65550,65537,65549,65546,65538,65547,65548,65539]
2020-11-05 02:13:16.080 [DEBUG] [g.tradfri.internal.TradfriCoapClient] - CoAP GET request
2020-11-05 02:13:16.080 [DEBUG] [g.tradfri.internal.TradfriCoapClient] - CoAP GET request
2020-11-05 02:13:16.081 [DEBUG] [g.tradfri.internal.TradfriCoapClient] - CoAP GET request
2020-11-05 02:13:16.081 [DEBUG] [g.tradfri.internal.TradfriCoapClient] - CoAP GET request
2020-11-05 02:13:16.082 [DEBUG] [g.tradfri.internal.TradfriCoapClient] - CoAP GET request
2020-11-05 02:13:16.082 [DEBUG] [g.tradfri.internal.TradfriCoapClient] - CoAP GET request
2020-11-05 02:13:16.083 [DEBUG] [g.tradfri.internal.TradfriCoapClient] - CoAP GET request
2020-11-05 02:13:16.083 [DEBUG] [g.tradfri.internal.TradfriCoapClient] - CoAP GET request
2020-11-05 02:13:16.086 [DEBUG] [.tradfri.internal.TradfriCoapHandler] - CoAP response
2020-11-05 02:13:16.087 [DEBUG] [ternal.handler.TradfriGatewayHandler] - requestDeviceDetails response: {"9001":"Pilot do rolet","9003":65550,"9002":1598718467,"3":{"0":"\u0002KE","1":"TRADFRI open/close remote","2":"","3":"2.2.010","6":3,"9":74},"9020":1600927722,"9054":0,"9019":1,"5750":0,"15009":[{"9003":0}]}
2020-11-05 02:13:16.088 [DEBUG] [al.discovery.TradfriDiscoveryService] - Adding device tradfri:0820:TRADFRIgateway:65550 to inbox
2020-11-05 02:13:16.090 [DEBUG] [.tradfri.internal.TradfriCoapHandler] - CoAP response
2020-11-05 02:13:16.091 [DEBUG] [ternal.handler.TradfriGatewayHandler] - requestDeviceDetails response: {"9001":"TRADFRI remote control 2","9003":65537,"9002":1598706854,"3":{"0":"IKEA of Sweden","1":"TRADFRI remote control","2":"","3":"2.3.014","6":3,"9":74},"9020":1604503606,"9054":0,"9019":1,"5750":0,"15009":[{"9003":0}]}
2020-11-05 02:13:16.091 [DEBUG] [al.discovery.TradfriDiscoveryService] - Adding device tradfri:0830:TRADFRIgateway:65537 to inbox
2020-11-05 02:13:16.092 [DEBUG] [.tradfri.internal.TradfriCoapHandler] - CoAP response
2020-11-05 02:13:16.093 [DEBUG] [ternal.handler.TradfriGatewayHandler] - requestDeviceDetails response: {"9001":"Pilot do rolet 2","9003":65549,"9002":1598717894,"3":{"0":"\u0002KE","1":"TRADFRI open/close remote","2":"","3":"2.2.010","6":3,"9":87},"9020":1604466470,"9054":0,"9019":1,"5750":0,"15009":[{"9003":0}]}
2020-11-05 02:13:16.094 [DEBUG] [al.discovery.TradfriDiscoveryService] - Adding device tradfri:0820:TRADFRIgateway:65549 to inbox
2020-11-05 02:13:16.095 [DEBUG] [.tradfri.internal.TradfriCoapHandler] - CoAP response
2020-11-05 02:13:16.095 [DEBUG] [ternal.handler.TradfriGatewayHandler] - requestDeviceDetails response: {"9001":"TRADFRI Signal Repeater","9003":65546,"9002":1598710506,"3":{"0":"IKEA of Sweden","1":"TRADFRI Signal Repeater","2":"","3":"2.2.005","6":1},"9020":1604506157,"9054":0,"9019":1,"5750":6,"15014":[{"9003":0}]}
2020-11-05 02:13:16.096 [DEBUG] [.tradfri.internal.TradfriCoapHandler] - CoAP response
2020-11-05 02:13:16.097 [DEBUG] [ternal.handler.TradfriGatewayHandler] - requestDeviceDetails response: {"9001":"TRADFRI bulb","9003":65538,"9002":1598706916,"3":{"0":"IKEA of Sweden","1":"TRADFRI bulb GU10 W 400lm","2":"","3":"1.2.214","6":1},"9020":1604486404,"9054":0,"9019":1,"5750":2,"3311":[{"5850":0,"5851":27,"9003":0}]}
2020-11-05 02:13:16.097 [DEBUG] [al.discovery.TradfriDiscoveryService] - Adding device tradfri:0100:TRADFRIgateway:65538 to inbox
2020-11-05 02:13:16.098 [DEBUG] [.tradfri.internal.TradfriCoapHandler] - CoAP response
2020-11-05 02:13:16.099 [DEBUG] [ternal.handler.TradfriGatewayHandler] - requestDeviceDetails response: {"9001":"TRADFRI blind","9003":65547,"9002":1598710588,"3":{"0":"IKEA of Sweden","1":"FYRTUR block-out roller blind","2":"","3":"2.2.009","6":3,"9":96},"9020":1604512967,"9054":0,"9019":1,"5750":7,"15015":[{"5536":100.0,"9003":0}]}
2020-11-05 02:13:16.099 [DEBUG] [al.discovery.TradfriDiscoveryService] - Adding device tradfri:0202:TRADFRIgateway:65547 to inbox
2020-11-05 02:13:16.100 [DEBUG] [.tradfri.internal.TradfriCoapHandler] - CoAP response
2020-11-05 02:13:16.101 [DEBUG] [ternal.handler.TradfriGatewayHandler] - requestDeviceDetails response: {"9001":"TRADFRI blind 2","9003":65548,"9002":1598715858,"3":{"0":"IKEA of Sweden","1":"FYRTUR block-out roller blind","2":"","3":"2.2.009","6":3,"9":93},"9020":1604512819,"9054":0,"9019":1,"5750":7,"15015":[{"5536":100.0,"9003":0}]}
2020-11-05 02:13:16.101 [DEBUG] [al.discovery.TradfriDiscoveryService] - Adding device tradfri:0202:TRADFRIgateway:65548 to inbox
2020-11-05 02:13:16.102 [DEBUG] [.tradfri.internal.TradfriCoapHandler] - CoAP response
2020-11-05 02:13:16.103 [DEBUG] [ternal.handler.TradfriGatewayHandler] - requestDeviceDetails response: {"9001":"TRADFRI bulb 2","9003":65539,"9002":1598707241,"3":{"0":"IKEA of Sweden","1":"TRADFRI bulb E27 CWS opal 600lm","2":"","3":"1.3.013","6":1},"9020":1604503796,"9054":0,"9019":1,"5750":2,"3311":[{"5850":0,"5851":119,"5707":9360,"5708":15880,"5709":22883,"5710":24868,"5706":"0","9003":0}]}
2020-11-05 02:13:16.103 [DEBUG] [al.discovery.TradfriDiscoveryService] - Adding device tradfri:0210:TRADFRIgateway:65539 to inbox`

Then communication stops:
`2020-11-05 02:25:16.099 [DEBUG] [.tradfri.internal.TradfriCoapHandler] - CoAP response
2020-11-05 02:25:16.100 [DEBUG] [ternal.handler.TradfriGatewayHandler] - onUpdate response: [65550,65537,65549,65546,65538,65547,65548,65539]
2020-11-05 02:25:16.101 [DEBUG] [g.tradfri.internal.TradfriCoapClient] - CoAP GET request
2020-11-05 02:25:16.102 [DEBUG] [g.tradfri.internal.TradfriCoapClient] - CoAP GET request
2020-11-05 02:25:16.102 [DEBUG] [g.tradfri.internal.TradfriCoapClient] - CoAP GET request
2020-11-05 02:25:16.103 [DEBUG] [g.tradfri.internal.TradfriCoapClient] - CoAP GET request
2020-11-05 02:25:16.103 [DEBUG] [g.tradfri.internal.TradfriCoapClient] - CoAP GET request
2020-11-05 02:25:16.104 [DEBUG] [g.tradfri.internal.TradfriCoapClient] - CoAP GET request
2020-11-05 02:25:16.104 [DEBUG] [g.tradfri.internal.TradfriCoapClient] - CoAP GET request
2020-11-05 02:25:16.105 [DEBUG] [g.tradfri.internal.TradfriCoapClient] - CoAP GET request
2020-11-05 02:25:16.108 [DEBUG] [.tradfri.internal.TradfriCoapHandler] - CoAP response
2020-11-05 02:25:16.109 [DEBUG] [ternal.handler.TradfriGatewayHandler] - requestDeviceDetails response: {"9001":"Pilot do rolet","9003":65550,"9002":1598718467,"3":{"0":"\u0002KE","1":"TRADFRI open/close remote","2":"","3":"2.2.010","6":3,"9":74},"9020":1600927722,"9054":0,"9019":1,"5750":0,"15009":[{"9003":0}]}
2020-11-05 02:25:16.110 [DEBUG] [al.discovery.TradfriDiscoveryService] - Adding device tradfri:0820:TRADFRIgateway:65550 to inbox
2020-11-05 02:26:16.053 [DEBUG] [g.tradfri.internal.TradfriCoapClient] - CoAP GET request
2020-11-05 02:27:16.054 [DEBUG] [g.tradfri.internal.TradfriCoapClient] - CoAP GET request
2020-11-05 02:28:16.056 [DEBUG] [g.tradfri.internal.TradfriCoapClient] - CoAP GET request
2020-11-05 02:29:16.058 [DEBUG] [g.tradfri.internal.TradfriCoapClient] - CoAP GET request
2020-11-05 02:30:16.061 [DEBUG] [g.tradfri.internal.TradfriCoapClient] - CoAP GET request
2020-11-05 02:31:16.063 [DEBUG] [g.tradfri.internal.TradfriCoapClient] - CoAP GET request
2020-11-05 02:32:16.064 [DEBUG] [g.tradfri.internal.TradfriCoapClient] - CoAP GET request
`

Also, uninstalling and installing Tradfri binding makes ZWave binding to lose communication.

**Comment by mvolaart** [comment]
Since i bought the IKEA Tradfri gateway and 2 drivers and 2 remote controls i also ran into the problem that sometimes the binding works flawlessly and sometimes all things were online but controlling didn't work. The logs were comparable of the of @artur3. Some initial communication and then only CoAP GET requests and no response anymore.

From my analysis i found it strange that the binding was finding a thing and added to the inbox (this is also seen in the logs of @artur3 ). I decided to build my own version of the binding disabling mainly the update channel to the deviceUpdateListeners 
```

    private synchronized void requestDeviceDetails(String instanceId) {
        // we are reusing our coap client and merely temporarily set a sub-URI to call
        deviceClient.setURI(gatewayURI + "/" + instanceId);
        deviceClient.asyncGet().thenAccept(data -> {
            logger.debug("requestDeviceDetails response: {}", data);
            JsonObject json = new JsonParser().parse(data).getAsJsonObject();
            **// deviceUpdateListeners.forEach(listener -> listener.onUpdate(instanceId, json));**
        });
        // restore root URI
        deviceClient.setURI(gatewayURI);
    }

```

This fixes my issues. Although this is certainly not the supposed solution, it is may helpfull finding the real root cause.

**Comment by artur3** [comment]
@mvolaart I have switched to the zigBee binding but my Tradfri devices still won't work reliable. Only one bulb is online all the time.  Two blinds and one bulb are online only for few minutes after OH restart. After they go offline I can still control them but there is no status update in OH. All four devices are very close (~1m) to each other and about 5m to zigBee dongle.

**Comment by artur3** [comment]
@J-N-K 
Tradfri still not working with latest firmware 1.14.24. 
openHAB 3.0.2

**Before bundle restart:**
`2021-06-24 09:22:15.636 [DEBUG] [g.tradfri.internal.TradfriCoapClient] - CoAP GET request
uri: coaps://192.168.5.26:5684/15011/15012
2021-06-24 09:23:15.638 [DEBUG] [g.tradfri.internal.TradfriCoapClient] - CoAP GET request
uri: coaps://192.168.5.26:5684/15011/15012`

**Bundle Restart:**
`2021-06-24 09:23:15.927 [INFO ] [alifornium.core.network.CoapEndpoint] - coaps Destroying endpoint at coaps://0.0.0.0:60165
2021-06-24 09:23:15.928 [INFO ] [alifornium.core.network.CoapEndpoint] - coaps Stopping endpoint at coaps://0.0.0.0:60165
2021-06-24 09:23:15.944 [DEBUG] [network.stack.CleanupMessageObserver] - canceled, Exchange[L3973] request [MID=51902, Token=602451836B17A5AF]
2021-06-24 09:23:15.945 [DEBUG] [network.stack.CleanupMessageObserver] - canceled, Exchange[L3972] request [MID=51901, Token=A01690158AE0BD67]
2021-06-24 09:23:15.945 [DEBUG] [network.stack.CleanupMessageObserver] - canceled, Exchange[L3980] request [MID=51909, Token=B8DF63E30A8C10CE]
2021-06-24 09:23:15.946 [DEBUG] [network.stack.CleanupMessageObserver] - canceled, Exchange[L3979] request [MID=51908, Token=5CA2937DD1346554]
2021-06-24 09:23:15.946 [DEBUG] [network.stack.CleanupMessageObserver] - canceled, Exchange[L3978] request [MID=51907, Token=4037974B594B680B]
2021-06-24 09:23:15.947 [DEBUG] [network.stack.CleanupMessageObserver] - canceled, Exchange[L3977] request [MID=51906, Token=E0EE949CD2DAD76B]
2021-06-24 09:23:15.947 [DEBUG] [network.stack.CleanupMessageObserver] - canceled, Exchange[L3976] request [MID=51905, Token=C415823345911D37]
2021-06-24 09:23:15.947 [DEBUG] [network.stack.CleanupMessageObserver] - canceled, Exchange[L3975] request [MID=51904, Token=B020511C2FE5E3AC]
2021-06-24 09:23:15.948 [DEBUG] [network.stack.CleanupMessageObserver] - canceled, Exchange[L3974] request [MID=51903, Token=3CB2B544F3EACC2F]
2021-06-24 09:23:17.022 [WARN ] [iscovery.TradfriDiscoveryParticipant] - Discovered Tradfri gateway doesn't have an IP address: [ServiceInfoImpl@1955658891 name: 'gw-a0c9a0d66dc5._coap._udp.local.' address: '(null):5684' status: 'NO DNS state: probing 1 task: null', has NO data, empty]
2021-06-24 09:23:17.051 [INFO ] [um.core.network.RandomTokenGenerator] - using tokens of 8 bytes in length
2021-06-24 09:23:17.051 [DEBUG] [network.InMemoryMessageExchangeStore] - coaps using TokenProvider org.eclipse.californium.core.network.RandomTokenGenerator
2021-06-24 09:23:17.052 [INFO ] [alifornium.core.network.CoapEndpoint] - coaps CoapEndpoint uses strict context
2021-06-24 09:23:17.052 [INFO ] [um.core.network.stack.BlockwiseLayer] - BlockwiseLayer uses MAX_MESSAGE_SIZE=1024, PREFERRED_BLOCK_SIZE=512, BLOCKWISE_STATUS_LIFETIME=300000, MAX_RESOURCE_BODY_SIZE=8192, BLOCKWISE_STRICT_BLOCK2_OPTION=false
2021-06-24 09:23:17.053 [INFO ] [.core.network.stack.ReliabilityLayer] - ReliabilityLayer uses ACK_TIMEOUT=2000, ACK_RANDOM_FACTOR=1.5, and ACK_TIMEOUT_SCALE=2.0 as default
2021-06-24 09:23:17.054 [INFO ] [alifornium.core.network.CoapEndpoint] - coaps Endpoint [coaps://0.0.0.0:0] requires an executor to start, using default single-threaded daemon executor
2021-06-24 09:23:17.054 [DEBUG] [alifornium.core.network.CoapEndpoint] - coaps Starting endpoint at coaps://0.0.0.0:0
2021-06-24 09:23:17.055 [DEBUG] [network.InMemoryMessageExchangeStore] - coaps no MessageIdProvider set, using default org.eclipse.californium.core.network.InMemoryMessageIdProvider
2021-06-24 09:23:17.058 [INFO ] [alifornium.core.network.CoapEndpoint] - coaps Started endpoint at coaps://0.0.0.0:45584
2021-06-24 09:23:17.065 [DEBUG] [g.tradfri.internal.TradfriCoapClient] - CoAP GET request
uri: coaps://192.168.5.26:5684/15011/15012
2021-06-24 09:23:17.072 [DEBUG] [.core.network.stack.ReliabilityLayer] - Exchange[L4685] send request, failed transmissions: 0
2021-06-24 09:23:17.075 [DEBUG] [.core.network.stack.ReliabilityLayer] - Exchange[L4685] prepare retransmission for CON-GET    MID=   -1, Token=null, OptionSet={"Uri-Path":["15011","15012"]}, no payload
2021-06-24 09:23:17.081 [DEBUG] [network.InMemoryMessageExchangeStore] - coaps Exchange[L4685] added with generated mid KeyMID[192.168.5.26:5684-63000], CON-GET    MID=63000, Token=null, OptionSet={"Uri-Path":["15011","15012"]}, no payload
2021-06-24 09:23:17.082 [DEBUG] [network.InMemoryMessageExchangeStore] - coaps Exchange[L4685] added with generated token KeyToken[192.168.5.26:5684-4C4068D7955E1DBC], CON-GET    MID=63000, Token=4C4068D7955E1DBC, OptionSet={"Uri-Path":["15011","15012"]}, no payload
2021-06-24 09:23:17.082 [DEBUG] [.californium.core.network.UdpMatcher] - tracking open request [MID: 63000, Token: Token=4C4068D7955E1DBC]
2021-06-24 09:23:17.098 [DEBUG] [.core.network.stack.ReliabilityLayer] - Exchange[L4686] send request, failed transmissions: 0
2021-06-24 09:23:17.099 [DEBUG] [.core.network.stack.ReliabilityLayer] - Exchange[L4686] prepare retransmission for CON-GET    MID=   -1, Token=null, OptionSet={"Uri-Path":"15001"}, no payload
2021-06-24 09:23:17.099 [DEBUG] [network.InMemoryMessageExchangeStore] - coaps Exchange[L4686] added with generated mid KeyMID[192.168.5.26:5684-63001], CON-GET    MID=63001, Token=null, OptionSet={"Uri-Path":"15001"}, no payload
2021-06-24 09:23:17.100 [DEBUG] [network.InMemoryMessageExchangeStore] - coaps Exchange[L4686] added with generated token KeyToken[192.168.5.26:5684-28E5DE63B27AA71B], CON-GET    MID=63001, Token=28E5DE63B27AA71B, OptionSet={"Uri-Path":"15001"}, no payload
2021-06-24 09:23:17.101 [DEBUG] [.californium.core.network.UdpMatcher] - tracking open request [MID: 63001, Token: Token=28E5DE63B27AA71B]
2021-06-24 09:23:17.153 [TRACE] [.californium.core.network.UdpMatcher] - received response ACK-2.05   MID=63000, Token=4C4068D7955E1DBC, OptionSet={"Content-Format":"application/json", "Max-Age":604800}, "{"9023":"0.tradfri.pool.".. 588 bytes
2021-06-24 09:23:17.153 [TRACE] [.californium.core.network.UdpMatcher] - received response ACK-2.05   MID=63001, Token=28E5DE63B27AA71B, OptionSet={"Content-Format":"application/json", "Max-Age":604800}, "[65538,65540,65536,65544".. 61 bytes
2021-06-24 09:23:17.154 [DEBUG] [se.californium.core.network.Exchange] - Exchange[L4685, complete]!
2021-06-24 09:23:17.154 [DEBUG] [network.InMemoryMessageExchangeStore] - coaps removing Exchange[L4685, complete] for token KeyToken[192.168.5.26:5684-4C4068D7955E1DBC]
2021-06-24 09:23:17.155 [DEBUG] [network.InMemoryMessageExchangeStore] - coaps removing Exchange[L4685, complete] for MID KeyMID[192.168.5.26:5684-63000]
2021-06-24 09:23:17.155 [DEBUG] [se.californium.core.network.Exchange] - local Exchange[L4685, complete] completed CON-GET    MID=63000, Token=4C4068D7955E1DBC, OptionSet={"Uri-Path":["15011","15012"]}, no payload!
2021-06-24 09:23:17.156 [TRACE] [clipse.californium.core.coap.Message] - Message completed CON-GET    MID=63000, Token=4C4068D7955E1DBC, OptionSet={"Uri-Path":["15011","15012"]}, no payload
2021-06-24 09:23:17.157 [DEBUG] [.tradfri.internal.TradfriCoapHandler] - CoAP response
options: {"Content-Format":"application/json", "Max-Age":604800}
payload: {"9023":"0.tradfri.pool.ntp.org","9080":60,"9204":1,"9059":1624519395,"9060":"2021-06-24T07:23:15.010960Z","9081":"7e2325520440000c","9062":0,"9061":0,"9107":0,"9073":28,"9029":"1.14.24","9082":false,"9083":"N/A","9077":31,"9236":3600,"9054":0,"9232":43300,"9055":0,"9208":1616893199,"9066":5,"9069":1624365356,"9105":0,"9071":1,"9201":1,"9103":"a1nvlh0fc0asuq.iot.eu-central-1.amazonaws.com","9072":3,"9074":0,"9075":59,"9076":10,"9078":1,"9202":1624365744,"9211":0,"9079":0,"9209":1635642000,"9092":1,"9093":0,"9106":0,"9200":"5f9a13ea-9b9c-4bdf-b950-2579b776b8b7","9118":0,"9235":"SE"}
2021-06-24 09:23:17.158 [DEBUG] [ternal.handler.TradfriGatewayHandler] - requestGatewayInfo response: {"9023":"0.tradfri.pool.ntp.org","9080":60,"9204":1,"9059":1624519395,"9060":"2021-06-24T07:23:15.010960Z","9081":"7e2325520440000c","9062":0,"9061":0,"9107":0,"9073":28,"9029":"1.14.24","9082":false,"9083":"N/A","9077":31,"9236":3600,"9054":0,"9232":43300,"9055":0,"9208":1616893199,"9066":5,"9069":1624365356,"9105":0,"9071":1,"9201":1,"9103":"a1nvlh0fc0asuq.iot.eu-central-1.amazonaws.com","9072":3,"9074":0,"9075":59,"9076":10,"9078":1,"9202":1624365744,"9211":0,"9079":0,"9209":1635642000,"9092":1,"9093":0,"9106":0,"9200":"5f9a13ea-9b9c-4bdf-b950-2579b776b8b7","9118":0,"9235":"SE"}
2021-06-24 09:23:17.162 [DEBUG] [se.californium.core.network.Exchange] - Exchange[L4686, complete]!
2021-06-24 09:23:17.162 [DEBUG] [network.InMemoryMessageExchangeStore] - coaps removing Exchange[L4686, complete] for token KeyToken[192.168.5.26:5684-28E5DE63B27AA71B]
2021-06-24 09:23:17.162 [DEBUG] [network.InMemoryMessageExchangeStore] - coaps removing Exchange[L4686, complete] for MID KeyMID[192.168.5.26:5684-63001]
2021-06-24 09:23:17.163 [DEBUG] [se.californium.core.network.Exchange] - local Exchange[L4686, complete] completed CON-GET    MID=63001, Token=28E5DE63B27AA71B, OptionSet={"Uri-Path":"15001"}, no payload!
2021-06-24 09:23:17.164 [TRACE] [clipse.californium.core.coap.Message] - Message completed CON-GET    MID=63001, Token=28E5DE63B27AA71B, OptionSet={"Uri-Path":"15001"}, no payload
2021-06-24 09:23:17.164 [DEBUG] [.tradfri.internal.TradfriCoapHandler] - CoAP response
options: {"Content-Format":"application/json", "Max-Age":604800}
payload: [65538,65540,65536,65544,65545,65539,65537,65541,65543,65542]
2021-06-24 09:23:17.165 [DEBUG] [ternal.handler.TradfriGatewayHandler] - onUpdate response: [65538,65540,65536,65544,65545,65539,65537,65541,65543,65542]
2021-06-24 09:23:17.166 [DEBUG] [g.tradfri.internal.TradfriCoapClient] - CoAP GET request
uri: coaps://192.168.5.26:5684/15001/65538
2021-06-24 09:23:17.166 [DEBUG] [g.tradfri.internal.TradfriCoapClient] - CoAP GET request
uri: coaps://192.168.5.26:5684/15001/65540
2021-06-24 09:23:17.167 [DEBUG] [g.tradfri.internal.TradfriCoapClient] - CoAP GET request
uri: coaps://192.168.5.26:5684/15001/65536
2021-06-24 09:23:17.168 [DEBUG] [g.tradfri.internal.TradfriCoapClient] - CoAP GET request
uri: coaps://192.168.5.26:5684/15001/65544
2021-06-24 09:23:17.168 [DEBUG] [g.tradfri.internal.TradfriCoapClient] - CoAP GET request
uri: coaps://192.168.5.26:5684/15001/65545
2021-06-24 09:23:17.169 [DEBUG] [g.tradfri.internal.TradfriCoapClient] - CoAP GET request
uri: coaps://192.168.5.26:5684/15001/65539
2021-06-24 09:23:17.169 [DEBUG] [g.tradfri.internal.TradfriCoapClient] - CoAP GET request
uri: coaps://192.168.5.26:5684/15001/65537
2021-06-24 09:23:17.170 [DEBUG] [g.tradfri.internal.TradfriCoapClient] - CoAP GET request
uri: coaps://192.168.5.26:5684/15001/65541
2021-06-24 09:23:17.170 [DEBUG] [g.tradfri.internal.TradfriCoapClient] - CoAP GET request
uri: coaps://192.168.5.26:5684/15001/65543
2021-06-24 09:23:17.171 [DEBUG] [g.tradfri.internal.TradfriCoapClient] - CoAP GET request
uri: coaps://192.168.5.26:5684/15001/65542
2021-06-24 09:23:17.172 [DEBUG] [.core.network.stack.ReliabilityLayer] - Exchange[L4687] send request, failed transmissions: 0
2021-06-24 09:23:17.172 [DEBUG] [.core.network.stack.ReliabilityLayer] - Exchange[L4687] prepare retransmission for CON-GET    MID=   -1, Token=null, OptionSet={"Uri-Path":["15001","65538"]}, no payload
2021-06-24 09:23:17.173 [DEBUG] [network.InMemoryMessageExchangeStore] - coaps Exchange[L4687] added with generated mid KeyMID[192.168.5.26:5684-63002], CON-GET    MID=63002, Token=null, OptionSet={"Uri-Path":["15001","65538"]}, no payload
2021-06-24 09:23:17.174 [DEBUG] [network.InMemoryMessageExchangeStore] - coaps Exchange[L4687] added with generated token KeyToken[192.168.5.26:5684-4CF76D1DC33E6FDB], CON-GET    MID=63002, Token=4CF76D1DC33E6FDB, OptionSet={"Uri-Path":["15001","65538"]}, no payload
2021-06-24 09:23:17.174 [DEBUG] [.californium.core.network.UdpMatcher] - tracking open request [MID: 63002, Token: Token=4CF76D1DC33E6FDB]
2021-06-24 09:23:17.175 [DEBUG] [.core.network.stack.ReliabilityLayer] - Exchange[L4688] send request, failed transmissions: 0
2021-06-24 09:23:17.176 [DEBUG] [.core.network.stack.ReliabilityLayer] - Exchange[L4688] prepare retransmission for CON-GET    MID=   -1, Token=null, OptionSet={"Uri-Path":["15001","65540"]}, no payload
2021-06-24 09:23:17.176 [DEBUG] [network.InMemoryMessageExchangeStore] - coaps Exchange[L4688] added with generated mid KeyMID[192.168.5.26:5684-63003], CON-GET    MID=63003, Token=null, OptionSet={"Uri-Path":["15001","65540"]}, no payload
2021-06-24 09:23:17.177 [DEBUG] [network.InMemoryMessageExchangeStore] - coaps Exchange[L4688] added with generated token KeyToken[192.168.5.26:5684-4C4B0FAE5A3F2E56], CON-GET    MID=63003, Token=4C4B0FAE5A3F2E56, OptionSet={"Uri-Path":["15001","65540"]}, no payload
2021-06-24 09:23:17.178 [DEBUG] [.californium.core.network.UdpMatcher] - tracking open request [MID: 63003, Token: Token=4C4B0FAE5A3F2E56]
2021-06-24 09:23:17.179 [DEBUG] [.core.network.stack.ReliabilityLayer] - Exchange[L4689] send request, failed transmissions: 0
2021-06-24 09:23:17.179 [DEBUG] [.core.network.stack.ReliabilityLayer] - Exchange[L4689] prepare retransmission for CON-GET    MID=   -1, Token=null, OptionSet={"Uri-Path":["15001","65536"]}, no payload
2021-06-24 09:23:17.180 [DEBUG] [network.InMemoryMessageExchangeStore] - coaps Exchange[L4689] added with generated mid KeyMID[192.168.5.26:5684-63004], CON-GET    MID=63004, Token=null, OptionSet={"Uri-Path":["15001","65536"]}, no payload
2021-06-24 09:23:17.180 [DEBUG] [network.InMemoryMessageExchangeStore] - coaps Exchange[L4689] added with generated token KeyToken[192.168.5.26:5684-9CC7C182F53818F0], CON-GET    MID=63004, Token=9CC7C182F53818F0, OptionSet={"Uri-Path":["15001","65536"]}, no payload
2021-06-24 09:23:17.181 [DEBUG] [.californium.core.network.UdpMatcher] - tracking open request [MID: 63004, Token: Token=9CC7C182F53818F0]
2021-06-24 09:23:17.182 [DEBUG] [.core.network.stack.ReliabilityLayer] - Exchange[L4690] send request, failed transmissions: 0
2021-06-24 09:23:17.183 [DEBUG] [.core.network.stack.ReliabilityLayer] - Exchange[L4690] prepare retransmission for CON-GET    MID=   -1, Token=null, OptionSet={"Uri-Path":["15001","65544"]}, no payload
2021-06-24 09:23:17.184 [DEBUG] [network.InMemoryMessageExchangeStore] - coaps Exchange[L4690] added with generated mid KeyMID[192.168.5.26:5684-63005], CON-GET    MID=63005, Token=null, OptionSet={"Uri-Path":["15001","65544"]}, no payload
2021-06-24 09:23:17.184 [DEBUG] [network.InMemoryMessageExchangeStore] - coaps Exchange[L4690] added with generated token KeyToken[192.168.5.26:5684-106A525F626DC370], CON-GET    MID=63005, Token=106A525F626DC370, OptionSet={"Uri-Path":["15001","65544"]}, no payload
2021-06-24 09:23:17.184 [DEBUG] [.californium.core.network.UdpMatcher] - tracking open request [MID: 63005, Token: Token=106A525F626DC370]
2021-06-24 09:23:17.185 [DEBUG] [.core.network.stack.ReliabilityLayer] - Exchange[L4691] send request, failed transmissions: 0
2021-06-24 09:23:17.186 [DEBUG] [.core.network.stack.ReliabilityLayer] - Exchange[L4691] prepare retransmission for CON-GET    MID=   -1, Token=null, OptionSet={"Uri-Path":["15001","65545"]}, no payload
2021-06-24 09:23:17.186 [DEBUG] [network.InMemoryMessageExchangeStore] - coaps Exchange[L4691] added with generated mid KeyMID[192.168.5.26:5684-63006], CON-GET    MID=63006, Token=null, OptionSet={"Uri-Path":["15001","65545"]}, no payload
2021-06-24 09:23:17.187 [DEBUG] [network.InMemoryMessageExchangeStore] - coaps Exchange[L4691] added with generated token KeyToken[192.168.5.26:5684-28E60AF69E69FD09], CON-GET    MID=63006, Token=28E60AF69E69FD09, OptionSet={"Uri-Path":["15001","65545"]}, no payload
2021-06-24 09:23:17.187 [DEBUG] [.californium.core.network.UdpMatcher] - tracking open request [MID: 63006, Token: Token=28E60AF69E69FD09]
2021-06-24 09:23:17.188 [DEBUG] [.core.network.stack.ReliabilityLayer] - Exchange[L4692] send request, failed transmissions: 0
2021-06-24 09:23:17.188 [DEBUG] [.core.network.stack.ReliabilityLayer] - Exchange[L4692] prepare retransmission for CON-GET    MID=   -1, Token=null, OptionSet={"Uri-Path":["15001","65539"]}, no payload
2021-06-24 09:23:17.189 [DEBUG] [network.InMemoryMessageExchangeStore] - coaps Exchange[L4692] added with generated mid KeyMID[192.168.5.26:5684-63007], CON-GET    MID=63007, Token=null, OptionSet={"Uri-Path":["15001","65539"]}, no payload
2021-06-24 09:23:17.189 [DEBUG] [network.InMemoryMessageExchangeStore] - coaps Exchange[L4692] added with generated token KeyToken[192.168.5.26:5684-94D57C71BEA431FD], CON-GET    MID=63007, Token=94D57C71BEA431FD, OptionSet={"Uri-Path":["15001","65539"]}, no payload
2021-06-24 09:23:17.190 [DEBUG] [.californium.core.network.UdpMatcher] - tracking open request [MID: 63007, Token: Token=94D57C71BEA431FD]
2021-06-24 09:23:17.191 [DEBUG] [.core.network.stack.ReliabilityLayer] - Exchange[L4693] send request, failed transmissions: 0
2021-06-24 09:23:17.192 [DEBUG] [.core.network.stack.ReliabilityLayer] - Exchange[L4693] prepare retransmission for CON-GET    MID=   -1, Token=null, OptionSet={"Uri-Path":["15001","65537"]}, no payload
2021-06-24 09:23:17.192 [DEBUG] [network.InMemoryMessageExchangeStore] - coaps Exchange[L4693] added with generated mid KeyMID[192.168.5.26:5684-63008], CON-GET    MID=63008, Token=null, OptionSet={"Uri-Path":["15001","65537"]}, no payload
2021-06-24 09:23:17.193 [DEBUG] [network.InMemoryMessageExchangeStore] - coaps Exchange[L4693] added with generated token KeyToken[192.168.5.26:5684-3488E6E26D419058], CON-GET    MID=63008, Token=3488E6E26D419058, OptionSet={"Uri-Path":["15001","65537"]}, no payload
2021-06-24 09:23:17.193 [DEBUG] [.californium.core.network.UdpMatcher] - tracking open request [MID: 63008, Token: Token=3488E6E26D419058]
2021-06-24 09:23:17.194 [DEBUG] [.core.network.stack.ReliabilityLayer] - Exchange[L4694] send request, failed transmissions: 0
2021-06-24 09:23:17.194 [DEBUG] [.core.network.stack.ReliabilityLayer] - Exchange[L4694] prepare retransmission for CON-GET    MID=   -1, Token=null, OptionSet={"Uri-Path":["15001","65541"]}, no payload
2021-06-24 09:23:17.195 [DEBUG] [network.InMemoryMessageExchangeStore] - coaps Exchange[L4694] added with generated mid KeyMID[192.168.5.26:5684-63009], CON-GET    MID=63009, Token=null, OptionSet={"Uri-Path":["15001","65541"]}, no payload
2021-06-24 09:23:17.195 [DEBUG] [network.InMemoryMessageExchangeStore] - coaps Exchange[L4694] added with generated token KeyToken[192.168.5.26:5684-1CCAD9F05363566F], CON-GET    MID=63009, Token=1CCAD9F05363566F, OptionSet={"Uri-Path":["15001","65541"]}, no payload
2021-06-24 09:23:17.196 [DEBUG] [.californium.core.network.UdpMatcher] - tracking open request [MID: 63009, Token: Token=1CCAD9F05363566F]
2021-06-24 09:23:17.197 [DEBUG] [.core.network.stack.ReliabilityLayer] - Exchange[L4695] send request, failed transmissions: 0
2021-06-24 09:23:17.197 [DEBUG] [.core.network.stack.ReliabilityLayer] - Exchange[L4695] prepare retransmission for CON-GET    MID=   -1, Token=null, OptionSet={"Uri-Path":["15001","65543"]}, no payload
2021-06-24 09:23:17.198 [DEBUG] [network.InMemoryMessageExchangeStore] - coaps Exchange[L4695] added with generated mid KeyMID[192.168.5.26:5684-63010], CON-GET    MID=63010, Token=null, OptionSet={"Uri-Path":["15001","65543"]}, no payload
2021-06-24 09:23:17.199 [DEBUG] [network.InMemoryMessageExchangeStore] - coaps Exchange[L4695] added with generated token KeyToken[192.168.5.26:5684-387AED954E895B96], CON-GET    MID=63010, Token=387AED954E895B96, OptionSet={"Uri-Path":["15001","65543"]}, no payload
2021-06-24 09:23:17.199 [DEBUG] [.californium.core.network.UdpMatcher] - tracking open request [MID: 63010, Token: Token=387AED954E895B96]
2021-06-24 09:23:17.200 [DEBUG] [.core.network.stack.ReliabilityLayer] - Exchange[L4696] send request, failed transmissions: 0
2021-06-24 09:23:17.201 [DEBUG] [.core.network.stack.ReliabilityLayer] - Exchange[L4696] prepare retransmission for CON-GET    MID=   -1, Token=null, OptionSet={"Uri-Path":["15001","65542"]}, no payload
2021-06-24 09:23:17.201 [DEBUG] [network.InMemoryMessageExchangeStore] - coaps Exchange[L4696] added with generated mid KeyMID[192.168.5.26:5684-63011], CON-GET    MID=63011, Token=null, OptionSet={"Uri-Path":["15001","65542"]}, no payload
2021-06-24 09:23:17.202 [DEBUG] [network.InMemoryMessageExchangeStore] - coaps Exchange[L4696] added with generated token KeyToken[192.168.5.26:5684-2C75475EF05E33ED], CON-GET    MID=63011, Token=2C75475EF05E33ED, OptionSet={"Uri-Path":["15001","65542"]}, no payload
2021-06-24 09:23:17.202 [DEBUG] [.californium.core.network.UdpMatcher] - tracking open request [MID: 63011, Token: Token=2C75475EF05E33ED]
2021-06-24 09:23:17.203 [TRACE] [.californium.core.network.UdpMatcher] - received response ACK-2.05   MID=63002, Token=4CF76D1DC33E6FDB, OptionSet={"Content-Format":"application/json", "Max-Age":604800}, "{"9001":"TRADFRI remote ".. 229 bytes
2021-06-24 09:23:17.204 [TRACE] [.californium.core.network.UdpMatcher] - received response ACK-2.05   MID=63003, Token=4C4B0FAE5A3F2E56, OptionSet={"Content-Format":"application/json", "Max-Age":604800}, "{"9001":"TRADFRI Signal ".. 224 bytes
2021-06-24 09:23:17.204 [TRACE] [.californium.core.network.UdpMatcher] - received response ACK-2.05   MID=63004, Token=9CC7C182F53818F0, OptionSet={"Content-Format":"application/json", "Max-Age":604800}, "{"9001":"TRADFRI motion ".. 226 bytes
2021-06-24 09:23:17.205 [TRACE] [.californium.core.network.UdpMatcher] - received response ACK-2.05   MID=63005, Token=106A525F626DC370, OptionSet={"Content-Format":"application/json", "Max-Age":604800}, "{"9001":"Roleta 3","9003".. 234 bytes
2021-06-24 09:23:17.206 [TRACE] [.californium.core.network.UdpMatcher] - received response ACK-2.05   MID=63006, Token=28E60AF69E69FD09, OptionSet={"Content-Format":"application/json", "Max-Age":604800}, "{"9001":"TRADFRI blind 2".. 241 bytes
2021-06-24 09:23:17.206 [TRACE] [.californium.core.network.UdpMatcher] - received response ACK-2.05   MID=63007, Token=94D57C71BEA431FD, OptionSet={"Content-Format":"application/json", "Max-Age":604800}, "{"9001":"TRADFRI remote ".. 231 bytes
2021-06-24 09:23:17.207 [TRACE] [.californium.core.network.UdpMatcher] - received response ACK-2.05   MID=63008, Token=3488E6E26D419058, OptionSet={"Content-Format":"application/json", "Max-Age":604800}, "{"9001":"TRADFRI open/cl".. 229 bytes
2021-06-24 09:23:17.207 [TRACE] [.californium.core.network.UdpMatcher] - received response ACK-2.05   MID=63009, Token=1CCAD9F05363566F, OptionSet={"Content-Format":"application/json", "Max-Age":604800}, "{"9001":"TRADFRI Signal ".. 226 bytes
2021-06-24 09:23:17.207 [TRACE] [.californium.core.network.UdpMatcher] - received response ACK-2.05   MID=63010, Token=387AED954E895B96, OptionSet={"Content-Format":"application/json", "Max-Age":604800}, "{"9001":"TRADFRI open/cl".. 231 bytes
2021-06-24 09:23:17.208 [DEBUG] [se.californium.core.network.Exchange] - Exchange[L4687, complete]!
2021-06-24 09:23:17.208 [DEBUG] [network.InMemoryMessageExchangeStore] - coaps removing Exchange[L4687, complete] for token KeyToken[192.168.5.26:5684-4CF76D1DC33E6FDB]
2021-06-24 09:23:17.209 [DEBUG] [network.InMemoryMessageExchangeStore] - coaps removing Exchange[L4687, complete] for MID KeyMID[192.168.5.26:5684-63002]
2021-06-24 09:23:17.209 [DEBUG] [se.californium.core.network.Exchange] - local Exchange[L4687, complete] completed CON-GET    MID=63002, Token=4CF76D1DC33E6FDB, OptionSet={"Uri-Path":["15001","65538"]}, no payload!
2021-06-24 09:23:17.210 [TRACE] [clipse.californium.core.coap.Message] - Message completed CON-GET    MID=63002, Token=4CF76D1DC33E6FDB, OptionSet={"Uri-Path":["15001","65538"]}, no payload
2021-06-24 09:23:17.210 [DEBUG] [.tradfri.internal.TradfriCoapHandler] - CoAP response
options: {"Content-Format":"application/json", "Max-Age":604800}
payload: {"9001":"TRADFRI remote control","9003":65538,"9002":1624366201,"9020":1624366274,"9054":0,"15009":[{"9003":0}],"9019":1,"3":{"0":"IKEA of Sweden","1":"TRADFRI remote control","2":"","9":16,"3":"2.3.014","6":3,"7":4545},"5750":0}
2021-06-24 09:23:17.210 [DEBUG] [ternal.handler.TradfriGatewayHandler] - requestDeviceDetails response: {"9001":"TRADFRI remote control","9003":65538,"9002":1624366201,"9020":1624366274,"9054":0,"15009":[{"9003":0}],"9019":1,"3":{"0":"IKEA of Sweden","1":"TRADFRI remote control","2":"","9":16,"3":"2.3.014","6":3,"7":4545},"5750":0}
2021-06-24 09:23:17.211 [DEBUG] [al.discovery.TradfriDiscoveryService] - Adding device tradfri:0830:gwa0c9a0d66dc5:65538 to inbox`

**Few minutes later:**
`2021-06-24 09:24:17.070 [DEBUG] [g.tradfri.internal.TradfriCoapClient] - CoAP GET request
uri: coaps://192.168.5.26:5684/15011/15012
2021-06-24 09:25:17.072 [DEBUG] [g.tradfri.internal.TradfriCoapClient] - CoAP GET request
uri: coaps://192.168.5.26:5684/15011/15012
2021-06-24 09:26:17.074 [DEBUG] [g.tradfri.internal.TradfriCoapClient] - CoAP GET request
uri: coaps://192.168.5.26:5684/15011/15012
2021-06-24 09:27:17.075 [DEBUG] [g.tradfri.internal.TradfriCoapClient] - CoAP GET request
uri: coaps://192.168.5.26:5684/15011/15012`

tcpdump shows no packets send to from gateway only:
`09:38:17.416398 IP tradfrigateway.home.mdns > 224.0.0.251.mdns: 0*- [0q] 5/0/0 PTR gw-a0c9a0d66dc5._coap._udp.local., (Cache flush) TXT "version=1.14.24", (Cache flush) SRV TRADFRI-Gateway-a0c9a0d66dc5.local.:5684 0 0, (Cache flush) A 192.168.5.26, (Cache flush) AAAA fe80::a2c9:a0ff:fed6:6dc5 (332)
09:38:17.676368 IP tradfrigateway.home.mdns > 224.0.0.251.mdns: 0*- [0q] 5/0/0 PTR gw-a0c9a0d66dc5._coap._udp.local., (Cache flush) TXT "version=1.14.24", (Cache flush) SRV TRADFRI-Gateway-a0c9a0d66dc5.local.:5684 0 0, (Cache flush) A 192.168.5.26, (Cache flush) AAAA fe80::a2c9:a0ff:fed6:6dc5 (332)
09:38:17.881394 IP tradfrigateway.home.mdns > 224.0.0.251.mdns: 0*- [0q] 5/0/0 PTR gw-a0c9a0d66dc5._coap._udp.local., (Cache flush) TXT "version=1.14.24", (Cache flush) SRV TRADFRI-Gateway-a0c9a0d66dc5.local.:5684 0 0, (Cache flush) A 192.168.5.26, (Cache flush) AAAA fe80::a2c9:a0ff:fed6:6dc5 (332)
09:39:57.413610 IP tradfrigateway.home.mdns > 224.0.0.251.mdns: 0*- [0q] 5/0/0 PTR gw-a0c9a0d66dc5._coap._udp.local., (Cache flush) TXT "version=1.14.24", (Cache flush) SRV TRADFRI-Gateway-a0c9a0d66dc5.local.:5684 0 0, (Cache flush) A 192.168.5.26, (Cache flush) AAAA fe80::a2c9:a0ff:fed6:6dc5 (332)
09:39:57.606623 IP tradfrigateway.home.mdns > 224.0.0.251.mdns: 0*- [0q] 5/0/0 PTR gw-a0c9a0d66dc5._coap._udp.local., (Cache flush) TXT "version=1.14.24", (Cache flush) SRV TRADFRI-Gateway-a0c9a0d66dc5.local.:5684 0 0, (Cache flush) A 192.168.5.26, (Cache flush) AAAA fe80::a2c9:a0ff:fed6:6dc5 (332)
09:39:57.888646 IP tradfrigateway.home.mdns > 224.0.0.251.mdns: 0*- [0q] 5/0/0 PTR gw-a0c9a0d66dc5._coap._udp.local., (Cache flush) TXT "version=1.14.24", (Cache flush) SRV TRADFRI-Gateway-a0c9a0d66dc5.local.:5684 0 0, (Cache flush) A 192.168.5.26, (Cache flush) AAAA fe80::a2c9:a0ff:fed6:6dc5 (332)`

Gateway and things are online all the time in openHAB. Why?
Restarting of entire openHAB solves problem for some short period of time.
Tradfri gateway works all the time with Ikea app.

**Comment by hmerk** [comment]
@artur3 
Is this bug still existing in openHAB 3.3 ?

**Comment by artur3** [comment]
Can't tell. I have switched to ZigBee2mqtt (openHab) and later to
HomeAssistant.

wt., 28 cze 2022, 10:51 użytkownik Hans-Jörg Merk ***@***.***>
napisał:

**Comment by lsiepel** [comment]
I can't find any more recent reports and the envolved users no longer use openhab or these devices. There are some related PR's:
https://github.com/openhab/openhab-addons/pulls?q=is%3Apr+tradfri+is%3Aclosed+in%3Atitle+tradfri+created%3A%3E2021-04-22

As this is a very well used binding, i would have expected many reports. Anyway, the main question is if someone is able to verify if this is still an issue with 3.4.0 stable and most recent Tradfri formware? If not, can we close this issue?

**Comment by mvolaart** [comment]
I don't use OH 3.4.0 yet, but i can confirm that for OpenHAB 3.3.0 i don't experience any issues
