### ISSUE TITLE
[mqtt] Retained Flag on Broker Thing seems to have no effect

### ISSUE THREAD

**Issue by rkoshak** [openhab/openhab-addons#6100]
There is the option to set the retained flag on a Broker Thing. However, that flag has no effect on messages published using the Action nor the LWT message. I haven't tested it recently but setting the retained flag on a Generic Thing does work.

## Expected Behavior

Ideally there should either be an option to set the retained flag on the LWT message and in the publishMQTT Action and the retained option removed from the Broker Thing or apply the retained flag set on the Broker Thing apply to all messages sent by that connection by default, overridable by the Generic MQTT Things.

## Current Behavior

Setting the retain flag on the Broker Thing has no effect.

## Steps to Reproduce (for Bugs)

1. Create a Broker Thing with the retained flag set.
2. Create a Rule and use that Thing to publish a message. 
3. Use an MQTT client to confirm that the message is not retained.

## Context

I'm trying to create a generic library implementation of the MQTT eventbus using JSR223 Rules. As part of this implementation I want to include online/offline status of the other OH using retained LWT messages (i.e. LWT publishes retained "OFFLINE") and when OH comes back it has a rule to publish retained "ONLINE" to the same topic.

In addition to this problem, I'm not certain the LWT actually gets sent but I'll open another issue after I look into that more closely.

## Your Environment

* Version used: (e.g., openhab and addon versions)
* Environment name and version (e.g. Chrome 39, node.js 5.4, Java 8, ...):
* Operating System and version (desktop or mobile, Windows 10, Raspbian Jessie, ...):
OH 2.5 M3 running on an RPi installed using openHABian.

**Comment by J-N-K** [comment]
Which OH version? Internal Broker or external broker?

**Comment by rkoshak** [comment]
External broker. Mosquitto version 1.6.5.

**Comment by J-N-K** [comment]
Will have a look. But probably not before the weekend. If I didn‘t respond on Monday, please ping me.

**Comment by J-N-K** [comment]
The retained flag on actions has been added with #5998. 

In general I think the retain parameter should be removed on the broker. It should be used on a per-topic-basis (which is working, I guess, at least we have test that shows that).

We can add a retain flag for the lwt, that makes sense.

**Comment by rkoshak** [comment]
> The retained flag on actions has been added with #5998.

So it was. Somehow I missed that it got merged. The docs need to be updated though. I'll throw together a PR real quick, it's a small update.

I completely agree, it should be removed from the broker and only have a flag that applies to the LWT message. I never liked having the flag set on the broker itself in the first place.

**Comment by Race666** [comment]
I reviewed the the [repository](https://github.com/openhab/openhab2-addons/blob/2.5.0.M3/bundles/org.openhab.binding.mqtt/src/main/java/org/openhab/binding/mqtt/action/MQTTActions.java) and saw that PR #5998 is already included in 2.5.0-M3.
I used the docker Image openhab/2.5.0.M3-arm64-debian but the retain flag does not work for me in a rule. I used the following rule to publish some values but the retain flag isn't set (verified with MQTT.fx and tcpdump)
```
rule "Publish updates to the event bus"
when
    Member of gPublish2MQTT received update
then
    val mqttActions = getActions("mqtt","mqtt:broker:mosquitto") // use your broker Thing ID
    mqttActions.publishMQTT("openHAB/out/"+triggeringItem.name+"/state",triggeringItem.state.toString,true)
    // logInfo("mqtt","Class class=[{}]",mqttActions.class)
end 
```
To ensure if the PR #5598 is included in my docker instance I altered the publishMQTT command with  illegal parameter for retain i.e.
```
mqttActions.publishMQTT("openHAB/out/"+triggeringItem.name+"/state",triggeringItem.state.toString,1)
```
then and error (as expected) with the function definition of publishMQTT is written to openhab.log and it seems it is the one with the retain bool parameter
 ```
org.openhab.binding.mqtt.action.MQTTActions.publishMQTT(org.eclipse.smarthome.core.thing.binding.ThingActions,java.lang.String,java.lang.String,java.lang.Boolean) 
```
retain flag on the broker thing is also set
```
      "configuration": {
        "properties": {
          "publickeypin": false,
          "clientid": "paho2656412346",
          "lastwill_qos": 0,
          "retain": true,
          "secure": false,
          "certificatepin": false,
          "keep_alive_time": 60000,
          "password": "MySecretPW",
          "qos": 0,
          "port": 1883,
          "host": "192.168.254.254",
          "reconnect_time": 60000,
          "username": "openhab"
        }
```
So the fix #5998 is applied but did not work for me in a rule.  A captured packet with tcpdump:
```
MQ Telemetry Transport Protocol, Publish Message
    Header Flags: 0x30, Message Type: Publish Message, QoS Level: At most once delivery (Fire and Forget)
        0011 .... = Message Type: Publish Message (3)
        .... 0... = DUP Flag: Not set
        .... .00. = QoS Level: At most once delivery (Fire and Forget) (0)
        .... ...0 = Retain: Not set
    Msg Len: 142
    Topic Length: 21
    Topic: home/heatpump/0/ASDin
    Message: 7b2244657461696c73223a20224f6666222c20224669656c…
```

Any Ideas?

**Comment by J-N-K** [comment]
I‘ll check that.

**Comment by Race666** [comment]
Thx

**Comment by J-N-K** [comment]
snapshot #1674, installed embedded broker and used autodetected broker thing, no additional configuration

```
rule "test"
when
  System started
then
  val mqttActions = getActions("mqtt","mqtt:systemBroker:embedded-mqtt-broker")
  mqttActions.publishMQTT("mytopic","myvalue", true)
end
```

results in

```
Frame 75: 62 bytes on wire (496 bits), 62 bytes captured (496 bits) on interface 6
Null/Loopback
Internet Protocol Version 4, Src: 127.0.0.1, Dst: 127.0.0.1
Transmission Control Protocol, Src Port: 50072, Dst Port: 1883, Seq: 1, Ack: 1, Len: 18
MQ Telemetry Transport Protocol, Publish Message
    Header Flags: 0x31, Message Type: Publish Message, QoS Level: At most once delivery (Fire and Forget), Retain
        0011 .... = Message Type: Publish Message (3)
        .... 0... = DUP Flag: Not set
        .... .00. = QoS Level: At most once delivery (Fire and Forget) (0)
        .... ...1 = Retain: Set
    Msg Len: 16
    Topic Length: 7
    Topic: mytopic
    Message: 6d7976616c7565
```

So works for me. Where did you capture the packet?

**Comment by Race666** [comment]
Shame on me you're right :-) Two mistakes on my side in addition. Looked into an old tcpdump capture file and  Dis-/connect the wrong MQTT.fx instance.
After reconnecting MQTT.fx the retained messages arrived:
```
MQ Telemetry Transport Protocol, Publish Message
    Header Flags: 0x31, Message Type: Publish Message, QoS Level: At most once delivery (Fire and Forget), Retain
        0011 .... = Message Type: Publish Message (3)
        .... 0... = DUP Flag: Not set
        .... .00. = QoS Level: At most once delivery (Fire and Forget) (0)
        .... ...**1 = Retain: Set**
    Msg Len: 41
    Topic Length: 35
    Topic: openHAB/out/RTRStellwertBadOG/state
    Message: 35332e30
```
Sorry for the inconvenience. Somtetimes it would be better to take a look at the issue at the next day instead of writing a error report....

Greetings from Nuremberg
Michael

**Comment by rkoshak** [comment]
Wait, the original solution to the issue was to remove the retained flag from the broker but allow the setting of the retained flag for the LWT message. Has that been done? I'm not seeing them on the msot recent snapshot. Is this issue closed prematurely or are those changes covered in some other issue I can subscribe to?

**Comment by J-N-K** [comment]
At least according to the documentation you can set retain for the LWT message. Is that not working?

**Comment by rkoshak** [comment]
I have a flag to set the retained flag on the whole broker (at least that is how it reads in the comment in PaperUI), but as the original issue above indicates, the flag doesn't appear to do anything. I can set the QOS of the LWT message but have no option to set the retained flag for the LWT message.
